category_name,category_id,video_id,title,channel_title,channel_id,description,duration,language,views,likes,published_at
Comedy,23,Ag7N4GC_0CY,Il rétrécit jusqu'à voir le monde en grand. 🤔,Crossthememory,UCzsdGXNzB9m0wXZwU05Fiyg,,PT58S,fr,561109,23579,2026-01-19T17:00:52Z
Comedy,23,RzIqEXfJWCE,Il voulait juste ses écouteurs🥹 #shorts,FlixFollower,UCnaWwU3x4BW-Kr-bQEzaiuw,,PT54S,fr,1368636,77836,2026-01-16T21:14:05Z
Comedy,23,2b3zqpC4fkc,top 6🤣🤣Julien beats #humour #drole #abonnetoi #subscribe,KDZ  OFF,UCK9trSjadKYooxbgPyXsyKg,,PT1M4S,en,946379,41104,2026-01-17T16:34:01Z
Comedy,23,XzY3efASrWw,Quand ma mère osait pas dire non devant tes potes #humour #pourtoi #foryou,nasgddrj,UCn-5Tuy_eLb1XtlCAEeG8eg,,PT58S,fr,1749891,72010,2026-01-14T10:31:01Z
Comedy,23,mjL53kFdKTM,#comedy #foryou #humour #funny #fyp,Jack,UCWUgk2CZ9gYIrEijEUqFB6A,,PT40S,fr,1019897,29909,2026-01-16T16:14:11Z
Comedy,23,wkKs0FDUMvs,Il a fini par se suic*der parce que tout le monde se moquait de sa taille!😢 #shorts #film,Cinémix 3000,UC6c-b6Q4PdwthX-PMjs6LUg,"⚠️ Avertissement – Contenu de fiction  Cette vidéo contient des extraits d’une œuvre de fiction (film ou série), utilisés à des fins de critique, d’analyse, d’illustration et d’information, conformément au principe d’utilisation équitable (fair use).  Les scènes présentées sont entièrement fictives, interprétées par des acteurs professionnels dans le cadre d’une production audiovisuelle.  Ce contenu ne promeut, ne justifie ni ne glorifie la violence, la haine ou des comportements dangereux.  La vidéo est partagée à des fins artistiques, éducatives et de divertissement.  La discrétion du spectateur est recommandée.",PT1M14S,fr-FR,1945696,0,2026-01-14T17:15:05Z
Comedy,23,vDN1dd69AKw,NE LES INVITEZ PAS 😂😅,Matthis et Alisée 🌱,UCtc8nVJJyNzljO-OGGGcQ6g,,PT59S,fr,612939,53969,2026-01-18T17:01:56Z
Comedy,23,1seYMbPfXVo,Ils se sont attaqués à la mauvaise cible | #respect #aura #shorts,Yopis,UC4yKAmxy9v0xPqS0T9V92GA,Crédit: no limit,PT51S,fr,752554,49527,2026-01-17T12:43:34Z
Comedy,23,xhSM4mev_ZA,IL A PIÉGÉ SON PETIT-FILS ! 😱💵🤫,Renard,UCIpZlT4tBRMD8kMMneXf0mg,Renard Malin #shorts,PT28S,fr,441977,16518,2026-01-19T17:01:39Z
Comedy,23,34v6L8HkbG8,Du jamais vu ! Cyprien 1er maître de midi prêt à partager l'étoile ! #12coupsdemidi,Les 12 Coups de Midi,UCwfQI2hGRh0t1SQMHYVHSrg,"🌟 Les #12CoupsdeMidi, c'est tous les jours dès 11h50 sur TF1 & TF1+  🌟 Plus de 𝗟𝗲𝘀 𝟭𝟮 𝗰𝗼𝘂𝗽𝘀 𝗱𝗲 𝗠𝗶𝗱𝗶 en streaming sur TF1+ https://www.tf1.fr/tf1/les-douze-coups-de-midi  Les jeux inclus dans ce programme diffusé en 2025 sont fermés",PT1M51S,fr,724668,21457,2026-01-17T15:00:07Z
Comedy,23,PG-fQsqYnjg,Toute ma scolarité 🥲,Monsieur Pof,UCNlqdJGKLYenAMNY4nevW-Q,,PT1M3S,fr,388291,37766,2026-01-20T15:44:13Z
Comedy,23,ALj3V2u9HJ0,QUAND Y’A UN CAMBRIOLEUR🏠🤣#humour #shorts,Le déraciné,UCpsvoU1qL4WLR6jvh1CWjhw,,PT21S,fr,587244,30582,2026-01-18T17:00:18Z
Comedy,23,vbUPtItTahw,Le réflexe du Kevin qui en dit long!,La Sotizerie,UCCeT4fTUiZJ0QCs65zii2uQ,,PT12S,fr,852688,17670,2026-01-14T17:40:46Z
Comedy,23,J44Tp_Ztkq4,Les Risques De S'improviser Coiffeur...#shorts #film #edit,Tibulle123,UCrOAM_t6ly5-Lw1OyIZ5dQg,"#avengersendgame #ironman #citation #captainamerica #thor #marvel #marvelstudios #edit   #sigma #2k #motivation #citationdujour #mindset #focus #sigma #viralvideo #viralshorts #viralshort #viralvideos #viral #pourtoi #fyp #spiderman #spidermannowayhome  Crédits:  Film: Young Sheldon (série S6 E4 ) Musique:  No Batidao  Apprendre un métier, ça ne s'improvise pas. Ce n'est qu'avec le temps et l'expérience que le talent émerge et que le geste devient sur. Si on n'est pas conscient de ces contingences, on s'expose a des déconvenues qui risquent de laisser des traces...   Apprentissage : C'est en forgeant qu'on devient forgeron  La musique, les graphiques et les images utilisé dans cette vidéo appartiennent a leur propriétaire légitime. Je ne possède rien a part le montage spécifique et le sous titrage original que j'ai réalisé. Mes vidéos visent à extraire d'une scène de film, avec un montage conséquent, des enseignements, des conseils, une moralité, une leçon ou des émotions pour faire réfléchir et réagir. Elle fournit des commentaires orignaux,  des critiques et une révision réfléchie, apportant une valeur ajoutée au delà des sources originales.",PT58S,fr,1541624,92976,2026-01-14T12:46:47Z
Comedy,23,Z-n4uoXm8ME,Jones vs. Hurst | Police Academy 5 😅😅😅,CINEMAnuel,UCzPTf0OWQgv7shg0kz8YkbA,"Larvell Jones (Michael Winslow - die menschliche Soundeffekte/Beatbox) rächt sich an Commander Hurst (George Robertson), nachdem dieser seinen Sitz im Flugzeug zum Schlafen ziemlich weit nach hinten lässt und Jones den Platz raubt. Lustiger Clip aus Police Academy 5: Auftrag Miami Beach (OT: Police Academy 5: Assignment Miami Beach). Viel Spaß!  #PoliceAcademy5 #MiamiBeach #Hurst #Jones #80erKomödie  #RetroFilm #Lustig",PT23S,en,20422770,598064,2026-01-13T15:51:24Z
Comedy,23,Vc8EcSPs_F8,"On élit la meilleure poignée de porte avec Sid (la saga continue, c’est un bonheur)",Mcfly et Carlito,UCDPK_MTu3uTUFJXRVcTJcEw,"Bienvenue dans un nouvel épisode de “MSD que choisir” (même si Carlito n’est pas inclus dans Mcfly - Sid - David)  Merci à notre frère Sid de nous suivre dans toutes ces explorations @Djilsi   Merci à Marie l’abonnée du jour   Lien d’inscription pour le formulaire d'inscription au trône de l'abonné : https://forms.gle/pyi3gGkS2AJ71wEK6   Chef OPV - Florent Sabatier OPV - Cyriac Labergère Chef OPS - Martin Bonami Maquillage - Karmen Sefer Déco - Jade et Valentina / Triple D  Montage - Florian Hautekiet Miniature - Oncle Sid  Productrice exécutive - Clara Lesage  Directrice de production - Blanche Martin Chargée de production - Romane Bioret Stagiaire de production - Jeanne De Pennart Administratrice de production - Sterenn Hall Chargée de post-production - Manon Bodinier  Unfold Production  Agent Mcfly et Carlito - Camille Blondeau Assistante Fatbros 2.0 - Chloé Wolf   Rejoignez notre discord officiel : https://discord.gg/mcflyetcarlito  INSTAGRAM ★ https://www.instagram.com/rafcarlito ★ https://www.instagram.com/levraimcfly ★ https://www.instagram.com/mcflyetcarlitouniverse  TIKTOK https://www.tiktok.com/@mcflyetcarlito?lang=fr https://www.tiktok.com/@davidtiktokmusic?lang=fr  TWITCH  https://twitch.tv/rafcarlito    ** Règles de l’espace commentaires : - Écrire dans un français correct (surtout pour Carlito ça) - Écrivez de façon respectueuse  - Pas de pubs, de spams du genre « me manque un abonné pour devenir stylé » ou encore « 3500 vues sans passer par Youvues, bravo ! »",PT49M30S,fr,1910285,94858,2026-01-15T17:29:00Z
Comedy,23,Ksj68CCNG9M,Il va falloir être plus précis. 🤣,SerendelleLL,UCkTjA1GY6FgMYP7jWPXihhQ,,PT32S,en-US,588575,20528,2026-01-16T23:49:00Z
Comedy,23,xl0s7dvpem8,#foryou #fypシ #fyp #pov #humor #comedia #shorts #viral #relatable #acting #fun #storytime,Firstsonw27R,UCvH93t77jf2ux66VZr5PrCA,,PT1M,en-US,355517,24473,2026-01-18T12:04:00Z
Comedy,23,HWyI0RCISEE,Quand ce sera mon tour d’être parent:,Assountïna,UCR5PY0zSAYfV8C5nGxZ8hWw,,PT31S,fr,602551,36484,2026-01-18T02:43:08Z
Comedy,23,EyeBERZQD3k,Cette farce est allée TROP loin avec de la farine💥,Nathan Hugo,UCaqyqj0bX7sDoT_li0Z7X_Q,"Note: This Video Is Made For Educational Purpose Only, everyone is safe Note: this was done by a professional; DO NOT ATTEMT. Note: everyone is safe Note: this was all setup  Credit: @respectful owner 😂 Cette vidéo capture une « farce » hilarante où un jeune homme piège une fille avec une « blague » bien orchestrée. L'« humour » de la situation est palpable, le « rire contagieux » des participants rendant ce moment de « divertissement » absolument « toto ». C'est un « sketch humoristique » de la comédie ! Note: This Video Is Made For Educational Purpose Only, everyone is safe Note: this was done by a professional; DO NOT ATTEMT. Note: everyone is safe Note: this was all setup  Credit: @respectful owner",PT19S,fr,450552,0,2026-01-19T17:53:00Z
Comedy,23,uEXkxDuFLgc,#fyp#foryou#funny#pov #humour#comedia#povacting,Josh84MH,UCtR0fL-oWHq0gOCZUiA-ytQ,,PT26S,en-US,1147662,40839,2026-01-13T13:18:00Z
Comedy,23,5iY3uL9vbBk,#relatable #skit#comedy #funny#shorts #pov #humour #lego #memes #storytime #humor #edit #food,ct64,UC8FBz419N7gXp9pvK4nKA-Q,,PT46S,fr,889831,17904,2026-01-16T06:56:15Z
Comedy,23,EEyZOr-WyC4,“Il se fait avoir par un agent… et son chien saute par la fenêtre😭””#anime？#movie#foryou,Quiverith Film,UCzegsdZHQ5s93VtaE2Ae-Pg,,PT46S,fr-FR,609387,27440,2026-01-15T09:08:24Z
Comedy,23,oMP2TEF1_lw,« Met la main dedans »😂,SUPERFLU,UCCmGQTHtgEMlZda1hUi7uuQ,"⚠️ Avis aux ayants droit ©️ Si vous êtes le titulaire des droits d’un contenu apparaissant dans cette vidéo et que vous estimez qu’il est utilisé de manière inappropriée, veuillez me contacter à l’adresse suivante : contact.velvetagency@gmail.com. Sur simple demande et sans débat, je m’engage à retirer immédiatement le contenu concerné.  📌 Crédits et sources Lorsque le ou les auteurs sont identifiés, les crédits sont mentionnés dans la description, le titre ou dans la vidéo elle-même. Aucun contenu n’est revendiqué comme étant original sauf mention contraire.  ⚖️ Utilisation équitable (Fair Use) Certaines vidéos de cette chaîne peuvent inclure des extraits d’œuvres protégées à des fins de commentaire, d’analyse, de critique ou d'information. Cela entre, autant que possible, dans le cadre du fair use ou des exceptions légales prévues par la législation applicable. Aucun usage n’a pour but de nuire à l’auteur original.  🚫 Clause de non-affiliation et de non-commercialisation Cette chaîne n’est pas monétisée. Aucun revenu n’est tiré de l’exploitation des contenus. Cette chaîne n’est affiliée à aucun ayant droit ni entreprise citée.  #humour #drole #blague #mdr  #rire  #frenchhumour #sketch  #humoristique  #videodrole #mourirderire #suprfl #memes #snapdrole #snapfr #humourmemes #tiktokfr #tiktokfrance   humour français, video drole, blague marrante, sketch comique, comédie française, rire garanti, humour 2025, meilleure video humour, moment marrant, youtubeur drole, humour absurde, parodie française, video humour 2025, stand up français, humour noir, superflu, superfl, suprfl",PT30S,fr-FR,788777,25744,2026-01-14T20:00:49Z
Comedy,23,TU8xsOh1UCQ,Ta tête ne va pas avec ton corps 😂 | Brice de Nice #film #cinema #comedie #humour #fr #brice #r,Top100comedy,UC7SqPCTzZSo2CkCMgPmeyaA,,PT45S,fr,542473,16454,2026-01-15T17:00:49Z
Comedy,23,ZBhrynGSW3g,POV : TU FAIS LA STAR ACADEMY AVEC TON PÈRE 🤦🏼‍♂️ #humour #sketch #sœur #drole #papa #chant #star,Casey & Tess (et Papa),UCOTFyq9dWeQdaRleHeiJHDw,,PT1M27S,fr,668251,39467,2026-01-19T16:16:03Z
Comedy,23,f61fIzbGTT0,#Comédie #Drôle #Rires #Merci #Humour #Amusement #fyp #fy,Gyiiodihoj4891,UCLRMFN5jXW0P5K6lcY_SQbg,,PT37S,en-US,430524,20574,2026-01-16T09:16:09Z
Comedy,23,LShLW4gQQLo,ÇA… C’EST PIRE QUE TRAVAILLER ! 😭😂,Malicia & Salva,UCh31W0F2lIlnYLNLIzEW0sQ,,PT30S,fr,481686,18586,2026-01-17T15:04:32Z
Comedy,23,esUaNGExFcI,Best of Prof/Eleves !! Je les adore vraiment mes élèves ! #maths #mathematiques #prof #professeur,Mirella Mckenzy,UCFbS8NZr8qQAaXcG__j9tlQ,,PT59S,fr,1252915,44561,2026-01-13T15:44:48Z
Comedy,23,3bNnhyXxmXY,Un jeu dangereux 🤣Audio: @thestanlley1 #humour #drole #sketch #cartoon #animation,Charly,UC20yJtI3AmNZq_3SzjkNwMg,,PT1M2S,fr,256361,20600,2026-01-19T11:10:00Z
Comedy,23,sXZ3SsQ8zuU,Fais la bonne mesure 📏 #2,Amixem,UCgvqvBoSHB1ctlyyhoHrGwQ,Ma boutique SPACEFOX.shop ! : https://bit.ly/spcfx-shop SUIS MOI ICI C'EST BIEN AUSSI :  → INSTAGRAM : http://bit.ly/amixeminsta → TIKTOK : https://bit.ly/AmixemTikTok → TWITTER :  http://bit.ly/AmixemTwitter → TWITCH AMIXEM :  http://bit.ly/AmixemTwitch → SNAPCHAT : amixemsnap  #amixem #humour #shorts #reels #trending #jeux,PT42S,fr,259624,15393,2026-01-19T16:45:00Z
Comedy,23,-bArFs-vnLA,#acting#fypシ#viral #pov #humor #comedia#coupleprank #drole #amour,EclipseStarZZ,UCgZBihc78J8fQ2ZB9FLjTtw,,PT43S,en-US,244697,18087,2026-01-17T16:37:00Z
Comedy,23,BMNzPDNbKSY,😱 CE TCHADIEN OUBLIE SON ARME…,RoyMilitary,UC3KzBCd_wDl3cV66F14mC9Q,"Durant une formation de l’armée française pour des tchadiens, un soldat a oublié son arme 😱👀 #shorts #viral #funny #armeedeterre",PT55S,fr,425762,22984,2026-01-17T18:51:10Z
Comedy,23,p9zwChqBid4,Bart et Lisa ont appris d’Homer 😅#simpsons #shorts #thesimpsons,Club des Simpson ,UCXqxbAHTSvfZ6VnWrI9YDNA,Bart et Lisa ont appris d’Homer 😅#simpsons #shorts #thesimpsos,PT58S,fr,462231,25295,2026-01-16T16:35:58Z
Comedy,23,e3u5Rk333gs,#foryou #humour #haveitoldyoulatelythatiloveyou,Đức Hoàng,UCCJyKIsFqqx8gJVgpL-FOvg,,PT57S,fr,1016188,27175,2026-01-14T10:51:24Z
Comedy,23,fgp4LsHidCk,"Je suis venu acheter une arme, mais quelque chose a mal tourné😱 #film",LeCoinDuFilm,UCATt4NQROPH2udEOYpRr2hw,,PT55S,fr,395654,26705,2026-01-16T20:25:48Z
Comedy,23,m9uU3a6jnuQ,C’est la première fois tu viens au bled ..🤣,lapatte,UC76lcT31R2-5ovyswEssqwg,,PT1M3S,fr,559791,18664,2026-01-17T17:42:10Z
Comedy,23,Yo8Yatsm2WA,S4E11 - La violence légitime,L'esprit critique,UCxSeJKYcO_4G_VrOlFykbSA,#avenantaucontrat #MoNtesQuiEu #balleperdu,PT2M59S,fr,606436,47851,2026-01-16T16:38:15Z
Comedy,23,LFqi4DQJeN4,Quand Elle a Lu Ton Journal,Hartin Pring,UCjAJCiifx6YSsmvqxNSAPSg,,PT59S,fr,292945,15350,2026-01-19T04:46:37Z
Comedy,23,a_2zxYtkt9M,LES PUNITIONS À L’ÉCOLE DANS LES DIFFÉRENTS PAYS 💀😳,Lil McQueen,UCiWsKciZy6GJhON0ICrmjPg,,PT1M5S,fr,576277,23485,2026-01-18T14:00:04Z
Comedy,23,k3zjfzvDVJM,Gueuuuuu 😂,Thomas Angelvy,UChsktaroVG6yI1cFOx4Hzzw,,PT2M17S,fr,221512,15104,2026-01-19T17:09:56Z
Comedy,23,NDDoVAygSGo,Quand les Notes Deviennent Ridicules 😅#shorts,Cinémotions,UCRN2QZoznm94_lNHcvGcd7w,,PT31S,fr,194150,6348,2026-01-18T20:15:00Z
Comedy,23,25eF8bbPDAk,SHREK c’était VRAIMENT un film de DÉTRAQUÉ,4Iroh,UCEYm--0SIxDh4d9RD1f_l2A,,PT1M10S,fr,420551,48726,2026-01-17T18:38:43Z
Comedy,23,n9QqpACsmqQ,Sachez que le carton sera à tout jamais dans notre studio 🤩🤣,Valise & Caramel,UCeX9wwj27d_Pp_PMl9vUcKg,,PT1M20S,fr,357523,28081,2026-01-17T17:15:00Z
Comedy,23,a2gd_7JMp0E,c'est fait pour ça les amies,Netflix France,UCroNr00O68n25IqSNapMK8w,"La série 2 BROKE GIRLS, c'est dispo.  Regarder sur Netflix : https://www.netflix.com  Abonne-toi à la chaîne YouTube de Netflix France ! : http://bit.ly/NetflixFr_Abonner  SUIVEZ-NOUS SUR NOS AUTRES RÉSEAUX SOCIAUX :  Facebook : https://bit.ly/2HcfVaJ X/Twitter : https://bit.ly/385OYRx Instagram : https://bit.ly/31tanlo TikTok : https://www.tiktok.com/@netflixfr  TUDUM !  Retrouvez sur cette chaîne les bandes-annonces de vos séries et films Netflix préférés (sous-titrés et/ou doublés en français parce qu’ici on est en France messieurs, dames et en France (attention info exclusive) ON PARLE FRANÇAIS), mais aussi des récapitulatifs (entre nous, on a tous une mémoire un peu courte, soyons honnêtes), des vidéos exclusives avec vos acteurs et actrices favoris mais pas que ! Il y aura toujours quelque chose de nouveau à découvrir sur cette chaine alors pour ne rien manquer, abonnez-vous !  Site : https://netflix.com/fr/  https://www.youtube.com/@NetflixFrance",PT1M28S,en-US,545846,35027,2026-01-17T12:00:00Z
Comedy,23,P4l0k7U25kU,SI LA GENTILESSE ÉTAIT INTERDITE 😂,Les Fripouilles,UCAVlO5ZQDwIWbIkqeVaJOaQ,"Mdrr en fait c’est pas un POV c’est la réalité 😂 Si vous voulez empêcher cette loi débile de passer, le lien est en bio ✨ En inondant sa boîte mail y’a moyen que ça passe pas ahah 🤞  Pour plus de détails sur cette loi : C’est une directive européenne qui menace de criminaliser tous ceux qui aideraient des personnes sans papiers, sous le prétexte de lutter contre le trafic. Donc on parle de la petite mamie qui distribue de la nourriture tous les dimanches, du médecin qui soigne, du sauvetage en mer, etc.  Ce qu’on demande c’est de modifier le texte pour ajouter au moins une clause d’exemption humanitaire, pour que les asso et ONG puissent continuer d’aider les personnes ayant besoin ! Sauf que @EPP bloque ce minimum du minimum. Il faut donc interpeller son vice-president @fxbellamy pour lui demander que son parti clarifie sa position. Merci d’avoir lu jusque là 🫶  Merci @benjerryfr (oui oui les glaces) d’avoir collaboré avec nous sur cette vidéo ❤️",PT1M9S,fr,233108,27030,2026-01-20T16:53:37Z
Comedy,23,jWEA0-OeTWw,Le mec d’estelle!😂 #humour #sketch,wwriofnk,UC46ZTpTW3pNQ1PWGsvOS3Pg,,PT59S,fr,302502,8317,2026-01-19T04:25:42Z
Comedy,23,rz2QduAFk3Y,Burns est très malade #movie #simpsons #foryou #short,Humberto Wz,UCsacti8fJF5Twx_NcIrXKtw,,PT1M11S,fr,471876,31384,2026-01-16T08:43:51Z
Comedy,23,_7q1Sf1D2wM,DIS LES MOTS EN RYTHME (ma mère me prank) #humour #prank,Arno Padawan,UCk9cPnPGGIcr_iciy1E5NhQ,ma mère me prank,PT34S,fr,788385,24753,2026-01-14T10:15:05Z
Comedy,23,NguJODA95GQ,Ma mère c’était vraiment ça 🤣🤣 trop beau pour être vrai ! Et vous  🙈 #humour #pourtoi #foryou,Ameli Khawari,UC6kOwGxxlLM0d6zQz-v_gNg,,PT39S,fr,378476,11387,2026-01-18T03:09:35Z
Comedy,23,HaK5loCoivU,🏆Meilleurs film/série (extrait n°570)🏆,PrincipeVF,UCQxzhZcxVVidGQf0sJxp33Q,🏆Cet agent de sécurité lui apprend le respect !🏆  🎥 : The Expandables 4  #citationdujour #film #agent #sécurité #respect #mindset #education #action,PT48S,fr,151529,10243,2026-01-19T17:00:28Z
Comedy,23,gagibJe0f4o,"Follow for music, memes & unexpected fun! #funnypranks #office #jobmemes",Maryna Aksenov,UCfGAa7X3gpPCNxwfG2di66A,"Follow for music, memes & unexpected fun! #funnypranks #office #jobmemes",PT14S,en,3929635,131378,2026-01-19T00:00:47Z
Comedy,23,CCLAW3bQwUU,Zootopia MAKEUP Trend 💄🐰 Made with Kling 2.6 🎬 #zootopia2 #klingai #kling26 #KlingMotionControl,Fairy Log,UCG6DV2XwHofa4uYDcgIRELw,"🐰💄 Judy Hopps Makeup Trend 💖  Judy Hopps jumps into the latest makeup trend, and of course, she does it her own way 😎🐰 Cool, confident, and curious, she starts by mixing red on her right hand ❤️ and white on her left hand 🤍.  She brings them together… The perfect pink is born 🎀  Suddenly everything changes 🌸 Her vibe? Pink. Her makeup? Pink. Her outfit? FULL pink glow-up 👗  From bunny cop to trend icon, Judy proves she can serve looks and creativity at the same time 🐰  Pink mode: activated 💖 Trend: mastered ✨  Would you try this makeup trend? 👇💄  #Zootopia #Zootopia2 #JudyHopps #funny #shorts #pink #pinku #makeup #colormixing   ✨ This is a fan-made parody video created with the help of AI tools. Not affiliated with Disney.",PT11S,en,22909887,371206,2026-01-17T14:24:47Z
Comedy,23,COn9qbe-e9A,Try something different next time 🙋🏿‍♂️ #learnfromkhaby #comedy,Khaby. Lame,UC86suRFnqiw8zN6LIYxddYQ,,PT17S,en,10080120,292519,2026-01-15T15:06:00Z
Comedy,23,AN7tWGwLsDQ,Tom Holland React Viral Videos 😂 (Part 36),Mr.Tom.Y.T,UCfn_5hjxMOPbFMQT4vfhQPg,,PT22S,en,8993328,0,2026-01-16T15:00:31Z
Comedy,23,oBbd3SItrCM,Quand tu te venges de ton prof. A ne pas faire évidemment ! 😆#prof.,Yeargin Bohnsack,UCbiuiCGarvdhg4uxNK8CQwA,,PT1M11S,fr,417326,14310,2026-01-17T05:22:21Z
Comedy,23,z0Ge2bVfLS4,1970s TV Audience SHOCKED by His Nunchaku Speed🔥,Built Different,UChoCV8QERjnhTKV5c4bwBJg,"In a recreated 1970s television demo show, a martial artist inspired by Bruce Lee steps on stage and unleashes nunchaku speed so fast the cameras struggle to keep up.  The audience freezes. The host is speechless. Every strike feels unreal.  This moment isn’t about tricks — it’s about discipline, control, and being BUILT DIFFERENT.  ⚠️ Historical recreation inspired by martial arts legends. 🎥 AI-generated cinematic short using Sora.  If you respect real discipline, real mastery, and timeless martial arts, this clip is for you.  👉 Watch till the end. #BuiltDifferent #BruceLeeInspired #MartialArtsLegend #1970sTV #Nunchaku #KungFu #MartialArtsShorts #ViralShorts #USAshorts #Discipline #SpeedAndPower",PT10S,en-US,6932944,142235,2026-01-16T16:15:10Z
Comedy,23,hfS_K0EcrL0,Mon gars les pieds ça va pas 😭 #shorts,2Freres2Frappes,UCXHYi57hE2Xch07upD-bFfg,,PT1M1S,fr,264477,16895,2026-01-18T17:06:38Z
Comedy,23,xTgRXXQUdk8,That was a clean break-and-run from the opening shot 😍,Học Bida Cùng Top,UCro26nIhvqorqcrfOwfAZbA,"Take a look at this masterpiece of creative performance art! This clip features a legendary act from the famous Japanese TV show ""Kasou Taishou"" (超級變變變). Using only simple props and incredible human synchronization, they’ve managed to recreate a game of pool that is both hilarious and mind-blowing.  Look closely—did you see the 8-ball go in early? Even in a comedy skit, the rules of pool still apply! 😂  Don't forget to:  ✅ Like if this made you laugh!  ✅ Subscribe for more creative billiards content.  ✅ Comment which ""ball"" had the best rolling technique! 🤣  #BilliardsLife #CreativeArts #JapaneseShow #ComedySkit #PoolTable #AmazingPerformance  🎱 HƯỚNG DẪN BIDA - TẬP LUYỆN HIỆU QUẢ CÙNG TRUNG TÂM BIDA TOP 🎱  Bạn đang tìm cách nâng cao kỹ thuật bida một cách bài bản? Bạn muốn luyện tập theo giáo trình chuẩn với chi phí hợp lý?  👉 Đừng bỏ qua Ebook ""170 Hình Bida Gom"" – hướng dẫn bởi HLV Nguyễn Phi Hùng, với giá chỉ 99K: 🔗 https://bidatop.com/san-pham/170-hinh-bida-gom-ebook-tap-luyen-cung-hlv-nguyen-phi-hung/  https://bidatop.com/san-pham/ebook-bida-3-bang-hinh-bi-bo-so-thong-dung-hon-400-trang-file-pdf  Ebook 400+ trang hình bi & bộ số thông dụng bằng tiếng Tây Ban Nha (PDF) — phù hợp để các bạn tự học và kết hợp dịch thuật.  Cơ bida lỗ Evo: https://bidatop.com/evocues  🎯 Thông tin lớp học bida đa dạng từ căn bản đến nâng cao cho các bộ môn: - Bida phăng, Bida lỗ: https://bidatop.com/day-bida-phang-tai-quan-binh-thanh-tu-co-ban-den-nang-cao/ - Bida 3 băng: https://bidatop.com/khoa-hoc-bida-3-bang-tai-tphcm/ 📅 Thời gian linh hoạt, mức học phí phù hợp cho mọi đối tượng. 📌 Chi tiết lớp học: https://bit.ly/daybida  🧑‍🏫 Miễn phí 1 buổi học thử tại: https://bidatop.com 📞 Hotline đăng ký: 0834 707 777  💡 Trung tâm Bida Top hiện liên kết với các CLB tại TP.HCM để hỗ trợ:  Giảm 30%-50% tiền giờ khi bạn đến luyện tập 1 người  Không gian tập luyện chất lượng, huấn luyện viên tận tâm  🔔 Đăng kí kênh YouTube Bida Top để theo dõi thêm các video hướng dẫn kỹ thuật, chiến thuật và biểu diễn bida hấp dẫn: 👉 https://bit.ly/bidatopchannel  #bidatop #bida #bidabinhthanh #dạy_bida #clbbidatop #hocbida #bidacoban #học_bida_tphcm #học_bida #bidabieudien #bidagom #bidakent #bidalibre #bidalo #BidaTop #LớpHọcBida #BidaBìnhThạnh #TPHCMBida #CâuLạcBộBida #HọcBidaCùngBidaTop #BidaClbBìnhThạnh #BidaLovers #BidaPassion #BidaSkills #BidaCommunity #BidaLife #BidaFun #BidaChampions #BidaGoals #BidaInspiration #BidaForever  🛠 Welcome to The Billiards Academi – nơi giúp bạn chinh phục đỉnh cao bida, từ cơ bản đến chuyên nghiệp. Hãy gia nhập cộng đồng đam mê bida và nâng tầm kỹ năng của bạn ngay hôm nay!",PT19S,ja,10721898,159866,2026-01-11T19:05:14Z
Comedy,23,0IiT6MfNxh4,"""Tag your siblings 🤣 #sisters #funny #funnyvideos #funnymeme #gymhumor #gymcomedy #comedy",Solar1Wisp,UCtJLc9jpcyW8hiKbv80gTSA,,PT21S,en-US,12806675,118637,2026-01-13T15:32:01Z
Comedy,23,KLH5OUmHukc,#jarry #lol #mdr #humour #blague  #comedyshorts #comedyshot #spectacle #tendance #top #show #drôle,GG La partie,UCjtiEsyfhcRb0-LPDBoBW8Q,,PT1M1S,fr,253124,5192,2026-01-17T10:51:26Z
Comedy,23,IH8kOjLsCtM,On pleure de rire devant ce redoublage de Cartman 😂 #onregardequoi #streamvf #doublage #vf,Donald Reignoux,UCMFKEOvaM2Dy0caLLSwD-6g,,PT56S,fr,210649,12917,2026-01-18T08:25:01Z
Comedy,23,ysq4ZetS98A,😭 Cette scène d' ishowspeed m'a détruit. Regarder bien,Amadix ,UC5csb-DmuQBhN0c3hcTtgPw,,PT12S,fr,1179165,21074,2026-01-15T11:24:28Z
Comedy,23,vG5Tk0BgaAE,il teste la trend challenge say the word mais.. 💀 #Shorts,Quentin grd,UCjyUHQ1kITjCttoTg8oJPIw,,PT29S,fr,376533,16212,2026-01-16T14:54:18Z
