category_name,category_id,video_id,title,channel_title,channel_id,description,duration,language,views,likes,published_at
Comedy,23,u9QrFfOMhrE,essaye de ne pas rire  #humour #humoristefrancais,Bobbywol,UCGU2PVFoThgS92VYquGxsrw,"Bienvenue sur la chaîne Essaye de ne pas rire 😂 Je te partage les meilleures vidéos d’humour TikTok . Ici, le concept est simple : te faire rire… ou au moins essayer ! Vidéos drôles, clips inattendus, moments absurdes, fails, memes et défis impossibles à regarder sans sourire. Chaque vidéo est un nouveau challenge : arriveras-tu à garder ton sérieux jusqu’à la fin ? Abonne-toi et mets ton self-control à l’épreuve 🔔",PT37S,fr,216545,6419,2026-01-17T15:03:12Z
Comedy,23,2HixOiMoI7s,Fallait pas passer devant lui a la boulangerie !🤣 I Le clan partie 27 #film #cinema #comedie #corse,Cinémotions,UCThR2cGvQQeLNanUAQ8CgFQ,,PT59S,fr,57533,2466,2026-01-20T17:00:10Z
Comedy,23,GVZTVq_h_64,Des French Dreamers vivent à 12 dans un petit appartement 😮,SOS ma famille a besoin d'aide ,UCHJsrKhw_nLTzW681yZC4-g,"Tous les épisodes de l'émission SOS Ma famille a besoin d'aide c'est ici 👉 https://bit.ly/3ZuXxRw Pascal le Grand Frère, drames familiaux et conflits parents-ados sont au programme. Abonnez-vous !  © La Concepteria",PT1M15S,fr,228903,8132,2026-01-15T06:00:16Z
Comedy,23,QatH51JEHdU,#relatable #skit #comedy #funny #shorts #pov,Franck Keller,UCd7oFfLYVtNkVs3RmCWAipA,,PT48S,fr,720802,13919,2026-01-11T14:58:34Z
Comedy,23,n2FyLToDujE,POURQUOI CE CLIENT EST-IL ÉTRANGE ?,[L2P] LES 2 PHILANTHROPES,UCEdRJHnA0vrbsAz9hH6jdyw,Abonne-toi pour du bon moment gratuit 😎 (merci)  #shorts,PT50S,fr-FR,516844,52029,2026-01-12T17:30:16Z
Comedy,23,SCrgu7vVG0E,POV: Your Friends Are Your Biggest Enemies😭😂 #shorts,Pretty Romantic,UCrvdMsIjkBv5VPUMZjSojaA,,PT15S,en,4976359,101145,2026-01-15T01:00:44Z
Comedy,23,rOIAsduDDbU,"OP: CaliforniaShelling Sharkbait, oo ha ha! #fail #comedy #funny #video #humor #life #cringe",Badge502,UCmw_imkgpf55eSOfC4hjxYw,Follow @emtbadge502 and join the family ❤️  OG: Californiashelling  Please..leave the ocean life alone I don’t want to respond to this.  #stitch #comedy #ems #emt #fyp #medical #trauma  #emergency #emergencyroom #doctor #nurse #ambulance #BookTok #firefighter #picture #rizz #genz #millennials #taylorswift #comedy #funny #humor #joke #reels #shortvideos #cringe #fail #fblifestyle #ocean #shark,PT15S,en,4995814,190800,2026-01-17T00:00:32Z
Comedy,23,TaEJ6kqeyxs,#funny,SANO ,UCSxm1CWD3C3WcavDXbCqofA,,PT18S,fr,64675,2225,2026-01-19T21:23:14Z
Comedy,23,oBC2n9fygNQ,Tom Holland Reacts To Viral videos part 134#tomholland #funny #reaction #entertainment #memes #viral,@Tommemefun00x,UCWnw1A8hr4Q1YvfjA5GUlqg,Tom Holland Reacts To Viral Videos part 134 || Best reaction funny video Tom Holland 2025  Subscribe:- https://www.youtube.com /@tommemefun00x/?sub_confirmation=1  Become a Member:- https://www.youtube.com /‎⁨@tommemefun00x/join   #tomholland #funny #reaction  #memes #tomholland #funny  #reaction  #memes  #explore  #entertainment  #prank  #respect  #sigma  #fail  #trend  #viral  #shorts  #cover  #spiderman  #america  #amazing #funnyvideos #funny #funnymemes #memes #comedy #meme #memesdaily #viral #dankmemes #fun #explorepage #tiktok #lol #trending #instagram #explore #love #follow #jokes #instagood #reels #humor #funnyvideo #comedyvideos #funnymeme #funnyshit #like #laugh #viralvideos #memepage#fxyoeditz #kiliyekiliye #fxyoeditz #flyxo #vaishalichaudharykhutail #uttarakhandirasoi #saanandverma #DuckRescue #CuteAnimal #AnimalRescue #DuckAndCat #TrueAnimalBond #DucklingHero #EmotionalAnimalStory #CuteDuckling #CatRescue #UnlikelyFriendship #DuckAdventure #HeartwarmingAnimals #InjuredCat #DuckSavesCat #KindnessInAnimalsTom Holland' FUNNIEST React  part 14#tomholland #funny #reaction #entertainment ‎⁨@MrBeast⁩  #memes Tom Holland’s funniest moments are back again! 😆 Part 11 is here — Can you stop laughing? Watch till the end for the best one! #TomHolland #FunnyReaction #Shorts #Tomdaya#TomHolland #FunnyReaction #TomHollandReactTom Holland Reacts To Viral Videos part.. 9|| Best reaction funny video Tom Holland 2025  Subscribe:- https://www.youtube.com /@tommemefun00x/?sub_confirmation=1  Become a Member:- https://www.youtube.com /‎⁨@tommemefun00x/join   #tomholland #funny #reaction  #memes #tomholland #funny  #reaction  #memes  #explore  #entertainment  #prank  #respect  #sigma  #fail  #trend  #viral  #shorts  #cover  #spiderman  #america  #amazingAmerica crazy funny video  #funny #entertainment #axplore #memes #shorts #trending  #Tomdaya #TryNotToLaugh #CelebrityReact #YTShorts #ShortsVideo #ViralShorts #ReactWithTom #funnyvideos #funny #funnymemes #memes #comedy #meme #memesdaily #viral #dankmemes #fun #explorepage #tiktok #lol #trending #instagram #explore #love #follow #jokes #instagood #reels #humor #funnyvideo #comedyvideos #funnymeme #funnyshit #like #laugh #viralvideos #memepage#fxyoeditz #kiliyekiliye #fxyoeditz #flyxo #vaishalichaudharykhutail #uttarakhandirasoi #saanandverma #DuckRescue #CuteAnimal #AnimalRescue #DuckAndCat #TrueAnimalBond #DucklingHero #EmotionalAnimalStory #CuteDuckling #CatRescue #UnlikelyFriendship #DuckAdventure #HeartwarmingAnimals #InjuredCat #DuckSavesCat #KindnessInAnimals,PT19S,en,4974986,144410,2026-01-19T13:00:00Z
Comedy,23,FWzQgU23RHg,#الشعب_الصيني_ماله_حل,idhak m3a ai,UC1jQxMyvNU3JNrwAaQ6Kodg,#فيديوهات_الذكاء_الاصطناعي #ضحك #إشترك_في_القناة #اكسبلور #النظافه #الشعب_الصيني_ماله_حل,PT14S,ar,2870504,33693,2026-01-12T19:24:45Z
Comedy,23,ftrU25p9oLA,Qui d'autres a déjà fait ça? 😅😅#lesenfants,The Cool Teacher,UC452R3t_ZOldzbw7a6Tn_UA,,PT48S,en-US,223965,4159,2026-01-17T08:57:37Z
Comedy,23,Auamy4qyfnw,He didn’t forget. 🤣 #funny #comedy #paulandchris #himor,Paul & Chris,UC5ovzYQiWeU784M10lB7lFg,,PT1M,en-US,9522719,156113,2026-01-16T20:00:09Z
Comedy,23,YcHt_iZRQlg,SORA MALTRAITE SES EMPLOYÉS ?? 😨,Sora,UCoY9dSehUOccMeV06OGmuQA,#sora #employes #alternance #prank #reaction  🌸 Ma marque de vêtements : http://www.hayami-shop.fr  👾 Ma chaîne Twitch : https://www.twitch.tv/sora 🎬 Ma chaîne secondaire : https://www.youtube.com/channel/UCrFnKXzLKT8PMAmbs5jDGkQ 🎮 Ma chaîne rediffusion : https://www.youtube.com/@SoraRediff  📷 Mon Instagram : https://www.instagram.com/sora/ 🐦 Mon X : https://twitter.com/universdesora 🎥 Mon TikTok : https://www.tiktok.com/@universdesora_ 👻 Mon Snap : https://www.snapchat.com/@sorasora_off  👥 Mon Discord : https://discord.gg/soraoff  📧 Mail pro : soramailpro@gmail.com,PT30S,fr,108217,8754,2026-01-18T18:00:38Z
