category_name,category_id,video_id,title,channel_title,channel_id,description,duration,language,views,likes,published_at
Entertainment,24,xTgRXXQUdk8,That was a clean break-and-run from the opening shot 😍,Học Bida Cùng Top,UCro26nIhvqorqcrfOwfAZbA,"Take a look at this masterpiece of creative performance art! This clip features a legendary act from the famous Japanese TV show ""Kasou Taishou"" (超級變變變). Using only simple props and incredible human synchronization, they’ve managed to recreate a game of pool that is both hilarious and mind-blowing.  Look closely—did you see the 8-ball go in early? Even in a comedy skit, the rules of pool still apply! 😂  Don't forget to:  ✅ Like if this made you laugh!  ✅ Subscribe for more creative billiards content.  ✅ Comment which ""ball"" had the best rolling technique! 🤣  #BilliardsLife #CreativeArts #JapaneseShow #ComedySkit #PoolTable #AmazingPerformance  🎱 HƯỚNG DẪN BIDA - TẬP LUYỆN HIỆU QUẢ CÙNG TRUNG TÂM BIDA TOP 🎱  Bạn đang tìm cách nâng cao kỹ thuật bida một cách bài bản? Bạn muốn luyện tập theo giáo trình chuẩn với chi phí hợp lý?  👉 Đừng bỏ qua Ebook ""170 Hình Bida Gom"" – hướng dẫn bởi HLV Nguyễn Phi Hùng, với giá chỉ 99K: 🔗 https://bidatop.com/san-pham/170-hinh-bida-gom-ebook-tap-luyen-cung-hlv-nguyen-phi-hung/  https://bidatop.com/san-pham/ebook-bida-3-bang-hinh-bi-bo-so-thong-dung-hon-400-trang-file-pdf  Ebook 400+ trang hình bi & bộ số thông dụng bằng tiếng Tây Ban Nha (PDF) — phù hợp để các bạn tự học và kết hợp dịch thuật.  Cơ bida lỗ Evo: https://bidatop.com/evocues  🎯 Thông tin lớp học bida đa dạng từ căn bản đến nâng cao cho các bộ môn: - Bida phăng, Bida lỗ: https://bidatop.com/day-bida-phang-tai-quan-binh-thanh-tu-co-ban-den-nang-cao/ - Bida 3 băng: https://bidatop.com/khoa-hoc-bida-3-bang-tai-tphcm/ 📅 Thời gian linh hoạt, mức học phí phù hợp cho mọi đối tượng. 📌 Chi tiết lớp học: https://bit.ly/daybida  🧑‍🏫 Miễn phí 1 buổi học thử tại: https://bidatop.com 📞 Hotline đăng ký: 0834 707 777  💡 Trung tâm Bida Top hiện liên kết với các CLB tại TP.HCM để hỗ trợ:  Giảm 30%-50% tiền giờ khi bạn đến luyện tập 1 người  Không gian tập luyện chất lượng, huấn luyện viên tận tâm  🔔 Đăng kí kênh YouTube Bida Top để theo dõi thêm các video hướng dẫn kỹ thuật, chiến thuật và biểu diễn bida hấp dẫn: 👉 https://bit.ly/bidatopchannel  #bidatop #bida #bidabinhthanh #dạy_bida #clbbidatop #hocbida #bidacoban #học_bida_tphcm #học_bida #bidabieudien #bidagom #bidakent #bidalibre #bidalo #BidaTop #LớpHọcBida #BidaBìnhThạnh #TPHCMBida #CâuLạcBộBida #HọcBidaCùngBidaTop #BidaClbBìnhThạnh #BidaLovers #BidaPassion #BidaSkills #BidaCommunity #BidaLife #BidaFun #BidaChampions #BidaGoals #BidaInspiration #BidaForever  🛠 Welcome to The Billiards Academi – nơi giúp bạn chinh phục đỉnh cao bida, từ cơ bản đến chuyên nghiệp. Hãy gia nhập cộng đồng đam mê bida và nâng tầm kỹ năng của bạn ngay hôm nay!",PT19S,ja,10721898,159866,2026-01-11T19:05:14Z
Entertainment,24,yHeGX-10zoY,Elle l'a laissé mourir de froid #animaux #amour #histoire #famille #adoption,Réalité Cachée ,UCgTD5km6OQDnK3yCEFRsxGQ,,PT1M4S,fr,665249,23631,2026-01-14T11:26:11Z
Entertainment,24,KLH5OUmHukc,#jarry #lol #mdr #humour #blague  #comedyshorts #comedyshot #spectacle #tendance #top #show #drôle,GG La partie,UCjtiEsyfhcRb0-LPDBoBW8Q,,PT1M1S,fr,253124,5192,2026-01-17T10:51:26Z
Entertainment,24,ICXPweBew2Q,#shorts #fun #fyp #challenge #funnyvideos #reaction #wow,Yaqata Guquloshi,UCeY-T_GXwaFDmyotAdVs2Rw,"📖🎬🌟 Relaxation & Creative Disclaimer  The channel shares content to entertain, provide calming visuals, and inspire creativity. Illegal content is not promoted 🚫. Some materials follow Fair Use guidelines. All rights remain with original creators ✉️.",PT44S,fr,389422,12864,2026-01-16T11:00:35Z
Entertainment,24,IH8kOjLsCtM,On pleure de rire devant ce redoublage de Cartman 😂 #onregardequoi #streamvf #doublage #vf,Donald Reignoux,UCMFKEOvaM2Dy0caLLSwD-6g,,PT56S,fr,210649,12917,2026-01-18T08:25:01Z
Entertainment,24,PAR_Eap1KVE,Si 2026 avait une discussion avec 2025 😱,BORDAS,UCtZNIaVKxT0fXNNrJZ3LKig,"Rejoignez cette chaîne pour bénéficier d'avantages exclusifs : https://www.youtube.com/channel/UCtZNIaVKxT0fXNNrJZ3LKig/join  Salut c'est Bordas, merci d'avoir regardé ma vidéo ! 🙃 Tu peux me soutenir en t'abonnant à ma chaine ou en likant la vidéo 👍  Tu peux aussi me retrouver sur les autres réseaux  Insta 👉 www.instagram.com/bordasofficiel TikTok 👉 www.tiktok.com/@bordasofficiel Twitch 👉 www.twitch.tv/la_bordasserie  À bientôt dans une prochaine vidéo",PT1M21S,fr,289695,31804,2026-01-18T15:48:55Z
Entertainment,24,ysq4ZetS98A,😭 Cette scène d' ishowspeed m'a détruit. Regarder bien,Amadix ,UC5csb-DmuQBhN0c3hcTtgPw,,PT12S,fr,1179165,21074,2026-01-15T11:24:28Z
Entertainment,24,FSG_fKkf1_0,Elle CHERCHAIT à l’ENVÔUTER 😮 | My Status as an Assassin | #anime #animeedit #shorts,Animes Harmony ,UCV2A2UtKxUcmce_DwhP2C5g,"Anime : My Status as an Assassin Obviously Exceeds the Hero's  Akira Oda, un lycéen ordinaire, est soudainement transporté dans un autre monde avec toute sa classe. Là, le royaume local leur confère des rôles héroïques pour combattre le Roi-Démon. Cependant, contrairement aux autres élèves qui obtiennent des classes prestigieuses comme Héros, Mage ou Paladin, Akira reçoit une classe inattendue : Assassin.  590",PT35S,fr,142705,14923,2026-01-20T16:00:30Z
Entertainment,24,3GNyw4uaAqU,Subscribe for an iPhone,MrBeast,UCX6OQ3DkcsbYNE6H8uQQuVA,"NO PURCHASE NECESSARY TO ENTER OR WIN. Takes place from 12:00 p.m. ET on January 13, 2026 through 11:59 a.m. ET on February 12, 2026.  See Official Rules at https://bit.ly/subthrow for eligibility requirements, individual entry periodsand complete details. Void where prohibited. Sponsor: MrBeastYouTube, LLC.",PT15S,en,47643087,3043513,2026-01-13T19:00:04Z
Entertainment,24,vG5Tk0BgaAE,il teste la trend challenge say the word mais.. 💀 #Shorts,Quentin grd,UCjyUHQ1kITjCttoTg8oJPIw,,PT29S,fr,376533,16212,2026-01-16T14:54:18Z
Entertainment,24,kYDzGJauurY,🤣 This Comedy Act Changed Everything | Judges Couldn’t Stop Laughing,Viral Talent Shorts,UCgMp7F1J984xYyKZxsrHCdQ,"Is comedy performance ne poore stage ka mahaul badal kar rakh diya! 😂 Jaise hi act shuru hua, audience hans hans kar pagal ho gayi aur judges apni hansi rok hi nahi paaye.  Ye sirf ek performance nahi thi, balkay timing, expressions aur confidence ka perfect mix tha jo har second ke sath aur bhi zyada entertaining hota gaya. Is act ne ye prove kar diya ke comedy kisi aik zaban ya mulk ki mohtaaj nahi hoti — agar talent real ho to duniya ke kisi bhi kone mein log connect kar lete hain.  Judges ke reactions, audience ki taaliyan aur stage ka energy level dekh kar ye kehna ghalat nahi hoga ke ye moment pure entertainment history ka yaadgaar hissa ban gaya. Kuch performances sirf funny hoti hain, lekin kuch aisi hoti hain jo logon ke chehron par muskurahat chor jaati hain — ye act bhi unhi mein se ek tha.  Agar aapko comedy, fun moments aur unique talent pasand hai, to ye video aapko poora entertain karega. Dekhiye, enjoy kijiye aur hansi share kijiye 😄✨  This video is shared for entertainment and inspiration purposes only.",PT46S,hi,7096526,210822,2026-01-14T15:21:38Z
Entertainment,24,Gspaur52_ww,Failed renovation#funny #foryou #funnyvideos #fail,funnypets327,UCngJgeFHANvu8iwmNmXoa7g,,PT1M16S,en,3367481,48986,2026-01-16T10:28:51Z
Entertainment,24,C1ARog_p7gg,Old Speed Would Not Hesitate 💀🤣 #ishowspeed #speed #edit,Ironaldox,UCYRrP22txtZdPr7t2IxkR9w,Old Speed Would Not Hesitate 💀🤣 #ishowspeed #speed #edit,PT30S,en,12862389,270217,2026-01-17T20:49:13Z
Entertainment,24,iUpjA1_9_WY,"Au revoir, mon ami.",Adam Paradisio,UC9UudF3Y2GqMt8ijMjYkdCw,,PT2M9S,fr-CA,296360,34662,2026-01-19T17:01:17Z
Entertainment,24,YLbretzLTwY,Ranking Funniest Statue Pranks #ep28,Devol Ranks,UC4dZSGOuA77n35iIYmfYSXw,Ranking Funniest Statue Pranks #ep28  #prank #statueprank #funnymoments,PT29S,en,19313250,596994,2026-01-17T15:30:30Z
Entertainment,24,lzdyc1mBFVk,Un ascenseur émotionnel 🤦‍♂️🤣,Sami2Bx,UCpvD6bcl1emZhwUTGOAmMcQ,,PT13S,fr,2342427,78947,2026-01-08T11:14:19Z
Entertainment,24,ejg_r5e8nJE,NAULLEAU MET KO YASSINE BELATTAR🥊,PolitiXmediaFR,UCMzxbsxxRl9vsIqrpbczUQg,"Un pied à l'Élysée, un pied sur scène : Naulleau dénonce l'imposture Belattar avec une punchline magistrale.   #clash #débat #naulleau #politique",PT17S,fr,135528,3398,2026-01-18T15:30:27Z
Entertainment,24,IZurz1sWiH8,Prank s’incruster dans une table mettre le malais #humour #videodrole #drole #mdr #prank #tropdrole,Hann,UCCv5FHssRGkLBnXm3ogmQWA,,PT28S,fr,575631,13255,2026-01-14T17:02:39Z
Entertainment,24,wH3rXhTeXkU,SI T’ARRIVES À LE REFAIRE T’ES UN BOSS  😏🤌,Ophenya,UCRFrYBCdWPUoDm13DbadaSw,,PT16S,fr,308295,17587,2026-01-18T10:31:01Z
Entertainment,24,U7q-bNjVieY,Jinu réussira-t-il à gagner le concours de la meilleure sculpture de VICE-VERSA ?!,Galaxy Toons 🌀,UCIXlyBzUC3Oo978YtAU9w-w,#jinu #kpop #kpopdemonhunters #mariobros #mario #rumi  #sajaboys,PT1M6S,fr-FR,284630,25019,2026-01-19T16:46:14Z
Entertainment,24,ARmpNXfq4qM,Le Singe Et L’Éléphant Sont Devenus Tout Colorés Dans L’Arc-En-Ciel￼,TudoG,UCJ2mGuuCGIRKFBKRdbHsu2w,This Video Is Made For Educational Purpose Only  📩 - Professional e-mail : tudogprofessionnel@gmail.com  #shorts,PT50S,fr,375472,25151,2026-01-18T17:51:18Z
Entertainment,24,UQOyPpOwtMw,Très à l'aise la gynéco 😭,Domingo,UCRCMNm2I4tM4BTmNSboc4QA,#domingo,PT1M3S,fr,372932,15986,2026-01-17T07:00:23Z
Entertainment,24,qj56SVN12bw,Erreur stupide,Animateur Rétrogradé,UCQp1YIDt2epIPkt5fXvV24w,,PT55S,fr,789942,39363,2026-01-08T01:32:28Z
Entertainment,24,oEa4WBqJmA8,We rank pizza SKILLS with EMOJ,Lionfield,UCHwpDpLoyJgtFXoAaaSut4Q,,PT20S,en-US,6618449,346359,2026-01-19T15:30:38Z
Entertainment,24,xmCT4bU9fvs,L’amour d’une grand-mère et l’erreur d’un enfant 😭💔🛵👵❤️#shorts,génie14-c8u,UCedDc2mS1-G0PCLG9zAJG9g,,PT55S,fr,358871,0,2026-01-19T17:01:43Z
Entertainment,24,sIoAvbyd53k,#gaming #funny #happy 😘😘,Elowen,UCejq79xLyaH_9qAyWsDmnrA,,PT1M2S,fr,616493,10712,2026-01-15T08:58:39Z
Entertainment,24,2uCpr58zdXo,Happiness and misfortune #shorts #reels #funny #crazy #car, EMKO,UCY58cW-ykwwD9K4-pG_rpKw,,PT15S,en-US,5824135,77280,2026-01-17T13:24:15Z
Entertainment,24,k0j3YmVPdmI,Military Weapon Disarm Techniques,Army Archive,UC--CMUaz0quSxSxTU4EooGw,Weapon disarm techniques demonstrated through structured training methods and fast reaction drills in a controlled environment.  #shorts #military #army,PT19S,en-US,7808354,179391,2026-01-16T20:10:21Z
Entertainment,24,xK4dy_1csKk,Never trust the internet,Glitch Giggles,UCzufTI0NdyYVmc_1_vY1ilw,,PT11S,en,24158836,422568,2026-01-11T12:21:41Z
Entertainment,24,EV3NqM52TnQ,EDGAR-YVES PAYE 600 € UN “COUPEUR DE PLUIE” POUR L’ENTERREMENT DE SON PÈRE AU BÉNIN,LEGEND,UCIh7PDUAP226Pa_NtjN9Jqw,Edgar-Yves paye “un coupeur de pluie” 600 € pour l’enterrement de son père au Bénin   Disponible sur YouTube et en podcast sur toutes les plateformes 🎬,PT1M22S,fr,1219106,47400,2026-01-11T12:30:26Z
Entertainment,24,DxoaP4OlC4Q,24 Frames per Second vs 24 Frames per Season 💀  #anime #jujutsukaisen #onepunchman,KingChris,UCu-pLexbz0lzAzwzXtd6v_Q,,PT15S,en,4180881,261076,2026-01-19T18:34:32Z
Entertainment,24,i1cV-ZLEIY4,#foryou #funny #youtubeshort,ppwyy,UCQHQUch0IkDZMmHqNp-uQmw,,PT1M19S,fr,472912,17034,2026-01-16T16:23:31Z
Entertainment,24,MeOSh_fqAaI,Il a débrancher son cerveau a cause de l'armée. 🤣 #shorts,FARSEP-EDIT,UClDciuwOXQVRjqjDSz5FRMg,Il a débrancher son cerveau a cause de l'armée. 🤣 #shorts   Crédit : Malcolm,PT54S,fr,890705,48508,2026-01-11T16:27:15Z
Entertainment,24,C_AxDjE9m_Q,Ranking Funniest Cast Removal Moments😭😭,Jugerko,UCU5aA-K2tmPpaNTE38yo_Vw,Ranking Funniest Cast Removal Moments,PT38S,en,3048202,90330,2026-01-19T10:07:14Z
Entertainment,24,uIzFVqT3y-4,La PIRE Maman... 🤣☠️ #Shorts,L'AUTRE ALEXANGA,UCH2GMzAqFCFnlscXw7oVqeQ,,PT1M7S,fr,474150,24118,2026-01-16T11:01:47Z
Entertainment,24,WIMwuxYM8cw,"If you did, don't forget to like, commented and subscribe to my channel.#shorts#youtube",Isaac,UCRdSwno12KONhMHZeV0AEQA,"⚠️Only for Entertainment purpose :- ✅ DISCLAIMER: This Channel does not promote any illegal product, content, or platform, doesn't encourage any kind of prohibited activities. All contents provided by this channel are meant for EDUCATIONAL purposes onlyDisclaimer: This Channel Does Not Promote Any illegal content, all contents provided by This Channel is meant for EDUCATIONAL and News Update purpose only. The content is based on individual research. Copyright Disclaimer Under Section 107 of the Copyright Act 1976, allowance is made for ""fair use"" for purposes such as criticism, comment, news reporting, teaching, scholarship, and research. Fair use is a use permitted by copyright statute that might otherwise be infringing. Non-profit, educational or personal use tips the balance in favor of fair use. am not the real owner of all the videos shown on our channel and all the credits go to the respectful owner. In case of copyright issues, please contact us for Credits or Removal.",PT13S,en-US,145240,3344,2026-01-19T16:00:55Z
Entertainment,24,Np30muFy5DE,Le Sac D’un CP😂#humour #shorts,Malikboutilevrai,UCaStCmz7b18VJ8j8MynxbOA,,PT16S,fr,260902,11684,2026-01-17T17:00:42Z
Entertainment,24,tztvnFfgLvY,Lemon Prank On My Friends!,Zhong,UCyagEfIN1okQ-s996XAqCFQ,,PT44S,en,3475172,91639,2026-01-20T13:01:59Z
Entertainment,24,gSBwlqEFX3c,the first move kills me 😂😂,Flashing Knight,UCwp0A2ne93NzhlCSA-nQsjA,,PT49S,en,14807726,493012,2026-01-15T18:53:19Z
Entertainment,24,hyJN7AMYXOY,你也来感受一下吧😈#海贼王 #funny #路飞,路飞与唐舞桐,UCQPMKK3ZuDep5FaCUJQYzQA,装扮海贼王角色，以动漫人设演绎现代搞笑剧情，油管的伙伴们大家好! 我是路飞与唐舞桐，正式入驻油管了，此频道唯一授权频道 其他频道皆为盗版，打击盗版，从我做起~ 海贼王粉丝千千万，路飞家的占一半 装扮海贼王角色，以动漫人设演绎现代搞笑剧情 每天带给你们开心快乐 ，要记得准时收看我的影片 哦! 赶紧订阅，路飞与唐舞桐在等你~ 本频道制作的所有视频都符合平台的使用政策，没有任何违规行为 我们的视频制作团队会特别关注儿童的安全需求，确保内容不会对其造成任何危害,PT12S,zh,22677663,215062,2026-01-18T10:15:05Z
Entertainment,24,59r2-8x6_F8,#humoristefrancais #humour #drole #funny #pov #questcequejedevraischoisir,Coralie5847,UCocseyrY3N8vLiOYq0JTs9A,,PT11S,en-US,347045,5099,2026-01-16T08:32:14Z
Entertainment,24,XCbWvFsnvnY,Выбери правильную коробку KPOP DEMON HUNTERS 😍,BRUNO,UCWXCAM8i0N6ZdShx8EqPSzg,"💖 Наш мерч - https://kratk.ru/m/IjMxGKit 🕹️ Игра ""Бруно и Аришнев Беги и Лети"" для Android - https://play.google.com/store/apps/details?id=com.greenblueinteractive.brunoandarishnevrunandfly 🕹️ Игра ""Бруно и Аришнев Беги и Лети"" для Apple - https://apps.apple.com/app/bruno-and-arishnev-run-and-fly/id6746455156  ● VK - https://vk.com/brunobroo ● Rutube - https://rutube.ru/channel/836193/ ● Телеграмм - https://t.me/+0Rj8ZIB33-E2OTFi ● Instagram - https://www.instagram.com/vilyambruno/  ● TikTok - https://www.tiktok.com/@brunobroo?_t=8pp7blKAtxH&_r=1",PT51S,ru,7719826,330727,2026-01-19T11:00:35Z
Entertainment,24,o3IuuLwJu1o,“Would that be the enemy?”#shorts #viral #trending #series,Hailey Eva,UCeaPzI-L4kkJ7jPIxcjU8hA,,PT44S,en-US,8633135,318147,2026-01-16T03:19:15Z
Entertainment,24,MvPoVX5XCHg,Il n'a PAS de FAMILLE 💔... 〢 Kotaro  #anime#animeedit#short,Mokutone ,UCrU1F9WBXIu6tb9039-dDJA,,PT59S,fr,267970,16518,2026-01-18T16:49:00Z
Entertainment,24,1zRUAz57otA,Daï Maito 🔥🗿,Gama-maru,UCv4LOsQmbKuj6u7JE2c3DqA,"ce moment montre la puissance du père de gai Maito. daï maito a prouvé que la volonté peut dépasser le talent.  Ignorez les tags :  #anime#anime4kedit#ytshorts#naruto#capcut#shorts#boruto#Sakura#Susuke#Kawaki#A0T#AttackOnTitan#erenjayger#Onepunchman #Saitama#AnimeAmv#AMV#Onepeice#Luffy#Highschool#NewAnime#Badasss#BestAnimeMoment#youtube#video#youtuber#music#love#newvideo#kpopedit#v#naruto naruto,narutoedits,narutoshippuden,narutoedit, anime,narutouzumaki,amv,sasuke,narutomemes,animeedits,narutoanim,boruto,kakashi,itachi,animeedit,sasukeuchiha,uchiha,amvedit,narutocosplay,sasukeedit,narutofan,amvedits,sakura,narutoart,narutoamvs,animeamv,amvs,manga,edits,uzumakinarutoshippuuden,obito,narutoxsasuke,akatsuki,borutonarutonextgenerations,madar,minato,hinata,sasukeamv,itachiuchiha,narutofanart,narutomanga,uzumakinaruto,amvanime,narutofans,onepiece,narutogaiden,kakashihatake,animeart,narutohokagenarutomeme,narutobrasil,narutotattoo,narutothelast,sharingan,narutoshipuden,shippuden,anime,animegirl,animeart,animememes,animes,animeboy,animegirls,animelove,animedrawing,animelover,animeworld,a nimefan,animeedit,animeedits,animefarns,animememe,animecosplay,animelife,animefanart,an imekawaii,animefreak,animelovers,animeartist,animestyle,animeamv,animemanga,animeindo,kawaianime,animedraw.animecouple,animeis life,animeboys,animemes,animeme,animeartwork,animeotaku,animecute,animesketch,loveanime,animeforlife,otaku,blackclover,animeedit, onepunchman,onepiecemanga,onepieceedit,dragonballz,onepieceloverjapan,usopp,deathnote, sasuke,boruto,animelover,onepieceindonesia,drawing,nicorobin,kawai,amv,fanart,dbz,brook,goku,memes,shanks,bokunoheroacademia,kimetsunoyaiba,franky,chopper,bhfyp,onepiecememes,narutoamv,naruto,narutoedits,narutoshippuden,narutoedit,anime,narutouzumaki,amv,sasuke,narutomemes,animeeditsnarutoanim,boruto,kakashi,itachi,animeedit,sasukeuchiha,uchiha,amvedit,narutocosplay,sasukeedit,narutofan,amvedits,sakura,narutoartnarutoamvs,animeam V,amvs,manga,edits,uzumak,narutoshippuuden, obito,narutoxsasuke,akatsuki,borutonarutonextgenerationsmadar,minato,hinata,sasukeamv,itachiuchiha,narutofanart,narutomanga,uzumakinaruto,amvanime,narutofans,onepiece,narutogaiden,kakashihatake,animeart,narutohokage,narutomeme,narutobrasil,narutotattoo,narutothelast,sharingan,narutoshipuden,shippuden,tsunade,Seclin,tsunadesenju,tsunadeisqueen,jiraiya,uchihasakura,haruno,harunosakura,naruhina,hinata,hinatahyuga,medicalninja,medicalninjuts,hokage,anime,itachi,itachiuchiha,uchiha,madara,obito,kakashi,animefans,narutofan,narutomemes,manga,uzumaki,sakura,shikadai,nara,shikamaru,animegirl,animeart,animememes,animes,animeboy,animegirls,animelove,animedrawinganimelover,animeworld,animefreak,animelovers,animeartist,animestyle,animeamv,animemanga,animeindo,kawaianime,animedraw.animecouple,animeislife,animeboys,animemes,animeme,animeartwork,animeotaku,animecute,animesketch,loveanime,animeforlife,otakunarutoamv,naruto,narutoedits,narutoshippuden,narutoedit,anime,narutouzumaki,amv,sasuke,narutomemes,animeedits,narutoanim,boruto,kakashi,itachi,animeedit,sasukeuchiha,uchiha,amvedit,narutocosplay,sasukeedit,narutofan,amvedits,sakura,narutoart,narutoamvs,animeamv,amvs,manga,edits,uzumak,narutoshippuuden,obito,narutoxsasuke,akatsuki,borutonarutonextgenerations,madar,minato,hinata,sasukeamv,itachiuchiha,narutofanartnarutomanga,uzmakinaruto,amvanime,narutofans,onepiece,narutogaiden,kakashihatake, an imeart,narutohokage,narutomeme,narutobrasil,narutotattoo,narutothelast,sharingan,narutoshipuden,shippuden,anime,animegirl,animeartanimememes,animes,animeboy,animegirls,animelove,animedrawing,animelover,animeworld,animefan,animeeditanimeedits,animefans,anime,animecosplay,animelife,animefanart,animekawaii,animefreak,animelovers,animeartist,animestyle,animeamv,animemanga,animeindo,kawaiianime,aninmedraw,animecouple,animeislife,animeboys,animemes,animeme,animeartwork,animeotaku,animecute,animesketch,loveanime,animeforlife,otaku,blackclover,animeedit,onepunchman,onepiecemanga,onepieceedit,dragonballz,onepieceloverjapan,usopp,deathnote,sasuke,boruto,animelover,onepieceindonesia,amvedits,sakura,narutoart,narutoamvs,animeamv,amvs,manga,edits,uzumak,narutoshippuuden,obito,narutoxsasuke,akatsuki,borutonarutonextgenerations,madar,minato,hinata,sasukeamv,itachiuchiha,narutofanartnarutomanga,uzumakinaruto,amvanme,narutofans,onepiece,narutogaiden,kakashihatake,animeart,narutohokage,narutomeme,narutobrasil,narutotattoo,narutothelast,shaingan,narutoshipuden,shippuden,tsunade,senjuclan,tsunadesenju,tsunadeisqueenjiraiya,uchiasakura,haruno,harunosakura,naruhina,hinata,hnatahyuga,medicalninja,medicalninjutsu,tsunadeedit,byakugou,hokage,anime,itachi,itachiuchiha,uchiha,madara,obito,kakashi,animefans,narutofan,narutomemes,manga,uzumaki,sakura,shikadai,nara,shikamaru,animegirl,animeart,animememes,animes,animeboy,animegirls,animelove,animedrawing,animelover,animeworld,animefan,animeedit,otaku",PT1M,fr,114927,10271,2026-01-20T17:00:08Z
Entertainment,24,pLH8MnxZvmk,burkinatiktok camerountiktok cotedivoire malitiktok ok moi jai pas peut #afrique #france #poutine,Continent des buzz,UCyEERmQTx3YpVzssbXkCLHw,,PT19S,fr-FR,790500,16291,2026-01-17T02:37:50Z
Entertainment,24,UT73z76W-_M,Ça pourrait vous arriver  😂,sjss,UCULhLq2ZbPStzmaIFIp1s2Q,,PT37S,fr,687352,22950,2026-01-13T12:58:01Z
Entertainment,24,W5ScpqunAD4,LILO MUSCLÉE 💪🏼 🤣 #shortvideo #humor,Diolinda,UCt-s3-72BVaTz-5qThfA_LQ,,PT16S,fr,161343,12336,2026-01-20T16:01:15Z
Entertainment,24,q_8UsgF2pJM,What are you wearing today? 😉❣️❣️❣️ #humor #foryou #fyp #pov #youtube #funnyshorts,Hien Nguyen,UCt967mRR8TN36uCC_frRXeg,"⚠️Only for Entertainment purpose :- ✅ DISCLAIMER: This Channel does not promote any illegal product, content, or platform, doesn't encourage any kind of prohibited activities. All contents provided by this channel are meant for EDUCATIONAL purposes only Disclaimer: This Channel Does Not Promote Any illegal content, all contents provided by This Channel is meant for EDUCATIONAL and News Update purpose only. The content is based on individual research. Copyright Disclaimer Under Section 107 of the Copyright Act 1976, allowance is made for ""fair use"" for purposes such as criticism, comment, news reporting, teaching, scholarship, and research. Fair use is a use permitted by copyright statute that might otherwise be infringing. Non-profit, educational or personal use tips the balance in favor of fair use. am not the real owner of all the videos shown on our channel and all the credits go to the respectful owner. In case of copyright issues, please contact us for Credits or Removal.",PT29S,en-US,187439,3958,2026-01-18T19:00:57Z
Entertainment,24,Y9W4SZTtVks,"Un toboggan pour maman, une balançoire pour l’enfant 🛝👩‍👦‍👦🎠😄!!#shorts",Filles charmantes ,UChGkXre5nWDroMSWi8A6cvQ,"Un toboggan pour maman, une balançoire pour l’enfant 🛝👩‍👦‍👦🎠😄!!#shorts",PT19S,fr,414627,0,2026-01-16T12:30:51Z
Entertainment,24,iY-HXh9KAUQ,Pourquoi il ne faut pas négliger ses pieds ?,Mini BoBo,UC7OXo-dsSO_E6aFT0jVjd4g,"On n’y pense jamais… mais la vie sous un pied, c’est l’enfer 😩🦶  Entre 👣 les pas lourds, 🧦 les chaussettes qui grattent, et l’ignorance totale du monde extérieur…  ce pauvre grain de beauté a décidé qu’il en avait assez 😤  Dans cette animation courte et absurde, découvre : 😂 comment un détail invisible prépare sa revanche 🤯 une transformation totalement inattendue 🎬 et pourquoi même les choses minuscules veulent parfois se faire remarquer  Une histoire inutile, improbable… 👉 donc totalement indispensable 😄  Abonne-toi pour des animations drôles, absurdes et beaucoup trop vraies ✨  ⸻  🔖 Hashtags  #Humour #Animation #Pied #Drole #VieQuotidienne #Insolite #AnimationCourte #VideoDrole #Absurd #Shorts",PT29S,fr,608444,23357,2026-01-15T21:59:28Z
Entertainment,24,3XPAHV9dwQk,Tu dois faire ton choix 😱😭,Lionel,UCXK2J35NiGK5PGFhTQsxs_w,,PT41S,fr,436036,24357,2026-01-16T17:00:10Z
Entertainment,24,Ogvg9jPDsU4,Cet homme redonne foi en l’humanité,DramatizeMe France,UCVZFXAxZ4E1nW-PN1Xfaosw,"Si vous avez aimé cette histoire, suivez notre page!",PT59S,fr,585166,28423,2026-01-17T13:00:00Z
Entertainment,24,_XrSt1I29T8,Oups,FAMILY PO,UC_yL1ZmLVIIekhuFkgkeYkA,,PT11S,fr,279330,4468,2026-01-16T21:20:26Z
Entertainment,24,JVpy3XgZI94,pas la meme vibe 🇯🇵🇨🇵 #france #couple #humour,unechtiaujapon ,UCV_OafNAkY46kBlWxGklF_Q,,PT32S,fr,131616,10567,2026-01-20T12:45:45Z
Entertainment,24,d1QBkHZsbnw,At least he got the shoe😂 | Man vs Baby (2025) - 4k Edit | Stereo Love - slowed,LaughTrack,UC1XgosSxwK9xtrMLsRzCbHw,At least he got the shoe😂 | Man vs Baby (2025) - 4k Edit | Stereo Love - slowed,PT38S,en,8892954,137107,2026-01-17T13:37:54Z
