category_name,category_id,video_id,title,channel_title,channel_id,description,duration,language,views,likes,published_at
Entertainment,24,xV_AGl1n_wk,Elle a montrée son talent #shorts,Tibulle123,UCrOAM_t6ly5-Lw1OyIZ5dQg,"#avengersendgame #ironman #citation #captainamerica #thor #marvel #marvelstudios #edit   #sigma #2k #motivation #citationdujour #mindset #focus #sigma #viralvideo #viralshorts #viralshort #viralvideos #viral #pourtoi #fyp #spiderman #spidermannowayhome  Crédits:  Film: American Girls Musique:  No Batidao  Ne pas juger l'apparence si on connait pas la personne qu'on juge   Apprentissage : Les apparences sont trompeuses    La musique, les graphiques et les images utilisé dans cette vidéo appartiennent a leur propriétaire légitime. Je ne possède rien a part le montage spécifique et le sous titrage original que j'ai réalisé. Mes vidéos visent à extraire d'une scène de film, avec un montage conséquent, des enseignements, des conseils, une moralité, une leçon ou des émotions pour faire réfléchir et réagir. Elle fournit des commentaires orignaux,  des critiques et une révision réfléchie, apportant une valeur ajoutée au delà des sources originales.",PT58S,fr,3981805,239817,2026-01-15T17:22:24Z
Entertainment,24,-n3Zi4yCRQc,Bouteille Pay ! 🤣🤣🤣,PasDurrrr,UC6gnyHB_kKiCpmoXUWKuWvg,#prank #humour,PT17S,fr,2113559,116931,2026-01-17T01:13:11Z
Entertainment,24,1Gl1SNiCiWs,"Bruce Lee, Amazing Speed",The Ai Democracy,UCscUvfx_DG7dSe5aNZIyw2w,#brucelee #sora2 #movie,PT11S,en,49757661,1472717,2026-01-16T23:50:59Z
Entertainment,24,uxitBlpDP5s,Ma femme veut un câlin… moi je fonce voir mon bébé😭💀 #Viral #humor #fyp #family #baby #love #papa,LePapaPoule 🐓,UC8rmdqo9-TijFFvgib2aRCQ,,PT10S,fr,1811208,44359,2026-01-16T17:28:20Z
Entertainment,24,JHNcAOP4rmo,Le pilote a contribué à rendre la voiture plus rapide🔥 #film,LeCoinDuFilm,UCATt4NQROPH2udEOYpRr2hw,,PT59S,fr,1026916,54900,2026-01-17T20:43:45Z
Entertainment,24,35uDPDHxJ8o,😳 Le mystère de cet bête étrange…,Fitness-Muscu,UCev7uCn7hMoehbcMj1sadcQ,"Dans cette vidéo on parle d’une légend dans le catch WWE ou un des catcheurs professionnel utilise un faux animal pour faire peur ou envoyer du jet orange  Personne n’a été blessé. Fait dans un cadre contrôlé  Fait par des professionnels entraînés dans un cadre supervisé. Ne pas reproduire.  If you are the owner of this video, please contact me at remi@fitness-muscu.com, and i will remove the video   This video follows the fair use guidelines imposed by my country (France) and any false copyright strike will be contested in the French court system.    Remarque : cette vidéo est réalisée à des fins éducatives uniquement, tout le monde est en sécurité.  Remarque : cette vidéo a été réalisée par un professionnel ; NE TENTEZ PAS DE LA REPRODUIRE.  Remarque : tout le monde est en sécurité.  Remarque : tout cela a été mis en scène.    🎬 Visuels : ©Propriétaire de la vidéo    🎙️ Narration, scénario : @fitness-muscu.    Remarque :    Si vous avez des questions concernant cette vidéo, qu'il s'agisse d'un problème de droits d'auteur ou d'une demande de suppression, n'hésitez pas à nous contacter à l'adresse  ((( )))  ⚖️ Clause de responsabilité légale    En vertu de l'article 107 de la loi de 1976 sur le droit d'auteur, l'« usage loyal » est autorisé à des fins telles que le commentaire, la critique, le reportage d'actualité, l'enseignement et la recherche. Cette disposition soutient l'utilisation à des fins éducatives, informatives et non commerciales",PT38S,fr,1368211,68102,2026-01-17T19:41:34Z
Entertainment,24,hAu1cKoVUOY,Je n’ai droit à aucune intimité 😭#abregefrere #couple #humour #cabinedessayage,abregefrere,UCGYVKSQXlRSUp-Ycp5miJKw,Je n’ai droit à aucune intimité 😭 #abregefrere #couple #humour #cabinedessayage,PT17S,en,532328,0,2026-01-20T15:31:46Z
Entertainment,24,bnoSf_2vhtw,Maudit correcteur automatique... #humour #sketch #couple #rigolo #correcteur #message #dispute,Ton pote Gillian,UCPwJrU0Xs2ewNufzHCc6Tnw,,PT26S,fr,631079,37609,2026-01-18T16:16:36Z
Entertainment,24,Ag7N4GC_0CY,Il rétrécit jusqu'à voir le monde en grand. 🤔,Crossthememory,UCzsdGXNzB9m0wXZwU05Fiyg,,PT58S,fr,561109,23579,2026-01-19T17:00:52Z
Entertainment,24,RzIqEXfJWCE,Il voulait juste ses écouteurs🥹 #shorts,FlixFollower,UCnaWwU3x4BW-Kr-bQEzaiuw,,PT54S,fr,1368636,77836,2026-01-16T21:14:05Z
Entertainment,24,1G1yoCXjwaA,Basé sur une histoire vraie - son fils était son dernier espoir pour échapper à son kidnappeur.,MT Yatt TV,UCo2TT0KUMvhi8HTV45Ox3kg,"🎥 crédit : Room (2015) Musique : Klem - Message  Catégorie : Thriller/drame. Lauréat d’un oscar.  Vidéo à but de critique, d’information, d’inspiration ou de divertissement.  Toutes les scènes de cet extrait sont fictives et réalisées par des professionnels de l’audiovisuel et n’encouragent en aucun cas l’utilisation de la violence et des armes par des adultes, ni par des enfants en particulier.  #shorts #cinema #film #series #room #truestory #histoirevraie #motivation #inspiration #leçondevie #education #famille",PT1M55S,fr-FR,1106679,60765,2026-01-18T12:42:25Z
Entertainment,24,2b3zqpC4fkc,top 6🤣🤣Julien beats #humour #drole #abonnetoi #subscribe,KDZ  OFF,UCK9trSjadKYooxbgPyXsyKg,,PT1M4S,en,946379,41104,2026-01-17T16:34:01Z
Entertainment,24,vQ7lU90nlTQ,Il a mérité sa correction,Brenus,UC6PQc5nI7c5pkz7sURAEHYg,"Crédits:  Film🎥: One piece  Musique🎵: No batidao  #avengersendgame #ironman #citation #captainamerica #thor #marvel #marvelstudios #edit   #sigma #2k #motivation #citationdujour #mindset #focus #sigma #viralvideo #viralshorts #viralshort #viralvideos #viral #pourtoi #fyp #spiderman #spidermannowayhome iron man thor thanos captaine américain hulk  4 fantastic   Un homme peut paraître froid sans être indifférent. Le silence, la retenue et le sang-froid peuvent devenir des remparts contre l’injustice. Défendre un plus faible ne demande pas de colère, seulement la décision de ne pas laisser faire  Instruction du jour : La vraie protection ne fait pas de bruit ; elle se tient droite et dit non.  Les musiques, graphismes et images présents dans cette vidéo sont la propriété exclusive de leurs détenteurs légitimes. Je ne revendique aucun droit sur ces éléments, à l’exception du montage spécifique et du sous-titrage original que j’ai moi-même réalisés. Le but de mes vidéos  visent à extraire d'une scène de film, avec un montage conséquent , des enseignements, des conseils, des réflexions morales ou des  émotions afin de susciter la réflexion et la réaction chez le spectateur. Elles proposent une analyse personnelle, des commentaires originaux et une interprétation critique, apportant une  valeur ajoutée par rapport aux œuvres originales.",PT38S,fr,813891,43674,2026-01-18T16:11:26Z
Entertainment,24,8TPwYQS5WXk,"Quand j'étais petit, je me suis pris une heure de colle pour rien...",120,UCSc6-tibHhQrMycThRDnOYw,Je me suis chopé ma première heure de colle en permanence pour une raison super nulle...,PT1M5S,fr,1016205,74871,2026-01-17T16:00:09Z
Entertainment,24,6_zvczlUYq0,"Elle veux L’ARNAQUER, mais… 😂 l Mob Psycho 100 l #anime #animeedit #shorts",Animoment VF,UCj_cMvvoZ6HRISAZq0PpFKg,,PT50S,fr,820024,63509,2026-01-17T16:45:01Z
Entertainment,24,B7G482a3xw4,Parfois l'impolitesse gagne 🤣🤣,L'observateur Moderne,UC85yDHXlXZOQBSejL_NEKKw,"⚠️ IMPORTANT: Si un extrait ou une image utilisés dans mes vidéos vous appartiennent et que vous souhaitez leur retrait, contactez-moi à l’adresse suivante : contact.boomlyrics@gmail.com, et je supprimerai le contenu concerné sans délai.  Lorsque la source d’un contenu est connue, elle est mentionnée directement dans la vidéo, le titre ou la description afin de respecter le travail de l’auteur original.  Observateur Moderne est une chaîne qui est indépendante, non affiliée aux créateurs originaux. Elle sert juste à apporter un minimum de sourire 🙂   #humour #drole #lobservateurmoderne #blague #mdr #rire #frenchhumour #sketch #humoristique #videodrole #memes #snapdrole #snapfr #shorts #instashorts #humourmemes #tiktokfr #tiktokfrance",PT1M,fr-FR,847960,51390,2026-01-17T11:00:00Z
Entertainment,24,qu9ivrn-X4I,Une semaine dans un caillou,Teddy Raconte,UCsq7jMw2A0ew_0KCX5GJTDQ,,PT47S,fr,993886,57644,2026-01-16T17:01:33Z
Entertainment,24,XzY3efASrWw,Quand ma mère osait pas dire non devant tes potes #humour #pourtoi #foryou,nasgddrj,UCn-5Tuy_eLb1XtlCAEeG8eg,,PT58S,fr,1749891,72010,2026-01-14T10:31:01Z
Entertainment,24,Imy4yYq9IW4,"UNDERCOVER NOCTURNE (Avec Anyme, Byilhan, Leila, Sofyan, Elian, Cocotte, Hctuan, Zaf, Raska, Doig)",Mastu,UCAhaFPP6v3WCfK5Tjao0B7A,"Téléchargez REVOLUT gratuitement avec ce lien  👉  https://get.revolut.com/z4lF/MaStu  Vous pourrez obtenir 20 € et participer au tirage au sort pour gagner 10 000 € (voir conditions générales).  Collaboration commerciale.  Nouvel épisode d’Undercover ! Merci à Anyme, Leila, Byilhan, Cocotte, Sofyan, Zafeel, Hctuan, Elian, Raska et Doigby (le père Noël fou) !  PRODUCTION : 3D2Y   Un concept de Mastu rendu possible avec l’accord de Yanstar Studio, un grand merci à eux de nous permettre l'adaptation de leur jeu Undercover.   Merci aux équipes !   Edito : Mastu, Brice Agent : Bloom Directrice de production : Carla Leprou Blanchard Assistantes de production : Ilona Druet & Luane Angenard  Chef opérateur vidéo : Pierre Le Louarn Cadreurs : Andy Caroça, Cédric Cheng, Noah Leprou Blanchard, Téo Erker, Pablo Ruiz, Benjamin Calvin, Simon Fegyveres, Ulysse Pointcheval, Léa De Sousa, Clément Sausseau  Photographe  : Shelly Anquetin   Chef électricien : Gio Bernardin Électricien : Jérémie Veuthey Électricienne : Jade Lebris  Chef opérateur son : Thomas Claire Ingénieur son : Alban Lejeune   Chef décorateur Hugo Cudot 1ère assistante décoratrice : Romane Terry Assistant-es décorateur : Luca Salvatore, Sofia Khier, Jules Bourbousson, Olivia, Chloé  Superviseur VFX : Marius Kamienieck Assistant-es VFX : Thomas Le Texier, Oriane Brisson  Cheffe costumière : Andréa Djidjirian Assistante costumière : Anaïs Borreguero  Makeup FX : So Agency   Cascadeurs : Manon Koltes, Stiven Brouard, Benji Poquet, Théo Auvinet, Pierre Guillaume, Thomas Fischer, Charlotte Auberget, Loriane Nuixa  Régisseur général : Fast Régie - Hugo Leggins Régisseur adjoint : Matteo Wust Régisseur : Lancelot Moreau Régisseur : Adrien Brouard  Montage : Jonas, Mewen Montage sponso : Sam Illustration : nasuumi Miniature : Hugo, Staku",PT51M28S,fr,2583265,178174,2026-01-17T10:02:00Z
Entertainment,24,0ux2iUBLLoc,"Les lives activités d'Anyme c'est quand même quelque chose 1 ballon 1 bougie, ça suffit",La_Twitcherie_FR,UCtjxxusUX9wYtBweA3j6Pyg,#anyme #twitch #clips #live #drole #shorts @AnymeTV,PT18S,fr,490034,12659,2026-01-18T10:30:01Z
Entertainment,24,wkKs0FDUMvs,Il a fini par se suic*der parce que tout le monde se moquait de sa taille!😢 #shorts #film,Cinémix 3000,UC6c-b6Q4PdwthX-PMjs6LUg,"⚠️ Avertissement – Contenu de fiction  Cette vidéo contient des extraits d’une œuvre de fiction (film ou série), utilisés à des fins de critique, d’analyse, d’illustration et d’information, conformément au principe d’utilisation équitable (fair use).  Les scènes présentées sont entièrement fictives, interprétées par des acteurs professionnels dans le cadre d’une production audiovisuelle.  Ce contenu ne promeut, ne justifie ni ne glorifie la violence, la haine ou des comportements dangereux.  La vidéo est partagée à des fins artistiques, éducatives et de divertissement.  La discrétion du spectateur est recommandée.",PT1M14S,fr-FR,1945696,0,2026-01-14T17:15:05Z
Entertainment,24,vDN1dd69AKw,NE LES INVITEZ PAS 😂😅,Matthis et Alisée 🌱,UCtc8nVJJyNzljO-OGGGcQ6g,,PT59S,fr,612939,53969,2026-01-18T17:01:56Z
Entertainment,24,1seYMbPfXVo,Ils se sont attaqués à la mauvaise cible | #respect #aura #shorts,Yopis,UC4yKAmxy9v0xPqS0T9V92GA,Crédit: no limit,PT51S,fr,752554,49527,2026-01-17T12:43:34Z
Entertainment,24,TYMH-8XrtMw,LE GARS LE PLUS SYMPA💵🤣#humour #shorts,Le déraciné,UCpsvoU1qL4WLR6jvh1CWjhw,,PT18S,fr,345199,20634,2026-01-20T17:00:03Z
Entertainment,24,XEH9UG0yCRI,QUI TOMBERA SUR LE PIMENT ? 😲🌶🔥 #shortsvideo,PLPSTUDIO,UCHP8mU1KI6YJCQjqhuC1FJA,UN JEU TRÈS PIMENTÉ 🔥,PT1M3S,fr,599417,23023,2026-01-19T13:54:20Z
Entertainment,24,H-WMU1NHbME,RITON ENGINEERING !!!,La Sotizerie,UCCeT4fTUiZJ0QCs65zii2uQ,,PT12S,fr,1309502,18652,2026-01-18T18:25:11Z
Entertainment,24,xhSM4mev_ZA,IL A PIÉGÉ SON PETIT-FILS ! 😱💵🤫,Renard,UCIpZlT4tBRMD8kMMneXf0mg,Renard Malin #shorts,PT28S,fr,441977,16518,2026-01-19T17:01:39Z
Entertainment,24,34v6L8HkbG8,Du jamais vu ! Cyprien 1er maître de midi prêt à partager l'étoile ! #12coupsdemidi,Les 12 Coups de Midi,UCwfQI2hGRh0t1SQMHYVHSrg,"🌟 Les #12CoupsdeMidi, c'est tous les jours dès 11h50 sur TF1 & TF1+  🌟 Plus de 𝗟𝗲𝘀 𝟭𝟮 𝗰𝗼𝘂𝗽𝘀 𝗱𝗲 𝗠𝗶𝗱𝗶 en streaming sur TF1+ https://www.tf1.fr/tf1/les-douze-coups-de-midi  Les jeux inclus dans ce programme diffusé en 2025 sont fermés",PT1M51S,fr,724668,21457,2026-01-17T15:00:07Z
Entertainment,24,PG-fQsqYnjg,Toute ma scolarité 🥲,Monsieur Pof,UCNlqdJGKLYenAMNY4nevW-Q,,PT1M3S,fr,388291,37766,2026-01-20T15:44:13Z
Entertainment,24,S3YrDViETAE,It's the best thing I've seen today 🥹❤️,Teddy Dear,UCJL9mc_79mw7ud8Yw9CBlHw,It's the best thing I've seen today 🥹❤️,PT19S,hi,43917851,1645025,2026-01-13T13:09:09Z
Entertainment,24,k5XoZKyhl5Y,Ce mec me drague pour son pote ?! 🤨 #helydia #twitch #pourtoi,Helydia,UCYP7NiekhNAGv1NOjcJQLvA,Contact : Contact@Helydia.fr  💖 S'abonner ➜ https://www.youtube.com/@helydiaa   🎥 Twitch ➜ https://www.twitch.tv/helydia 🐤 Twitter ➜ https://twitter.com/helydiaa ⚫ TikTok ➜ https://www.tiktok.com/@helydiaa 📷 Instagram ➜ https://www.instagram.com/helydiaa/ 🔵 Discord ➜ https://discord.gg/hely,PT52S,fr,468690,40732,2026-01-19T17:01:14Z
Entertainment,24,Xb36PiZyy5Y,#fyp #pourtoi #humour #enfant #sketch #cambrioler,Liebler Ricker,UCa7jsMaMcsB0xooSbv321pQ,,PT23S,fr,969380,17400,2026-01-16T07:58:20Z
Entertainment,24,FwwVD0V9kLc,LES DIFFÉRENTES TECHNIQUES DE TRICHES UTILISÉES PAR LES MARQUES POUR LES PUBLICITÉS 💀😳,Lil McQueen,UCiWsKciZy6GJhON0ICrmjPg,,PT1M5S,fr,954235,47904,2026-01-17T14:00:32Z
Entertainment,24,xCQqwGum3rk,T’as déjà essayé de duper ta mère #humour #parodie #maman Collaboration commerciale avec,Broks Worlow,UCyTwWmatUc1V0Oiphq0eq1Q,,PT59S,fr,658796,23013,2026-01-18T08:17:41Z
Entertainment,24,S3qU6zpTJqo,Legendary Bruce Lee Coin Demo Leaves Host Speechless!,Built Different,UChoCV8QERjnhTKV5c4bwBJg,"""Watch Bruce Lee’s legendary precision in action with a 1970s TV show coin demonstration! Bruce Lee–inspired martial artist showcases his incredible speed, focus, and control by moving a coin with a single finger strike, leaving the host and audience in absolute shock.  This demonstration highlights not only his unmatched hand speed but also his mastery of mind-body control, Jeet Kune Do philosophy, and explosive precision. Witness why Bruce Lee was truly Built Different.  🎥 See more Bruce Lee inspired demonstrations on Built Different:  **Authentic References on Bruce Lee’s Speed & Demonstrations**  • Bruce Lee’s legendary lightning‑fast coin trick and speed demonstrations   https://vocal.media/fyi/why-many-consider-bruce-lee-super-human  • Bruce Lee’s one‑inch punch demo at Long Beach International Karate Championships   https://en.wikipedia.org/wiki/Long_Beach_International_Karate_Championships  • Physics & biomechanics behind his explosive power (Science breakdown)   https://archive.nerdist.com/bruce-lees-physics-one-inch-punch-science/  • Bruce Lee’s actual TV interview appearances in the early 1970s   https://en.wikipedia.org/wiki/Bruce_Lee%3A_The_Lost_Interview  • Bruce Lee unusual feats and demonstrations (IMDb trivia)   https://www.imdb.com/name/nm0000045/trivia/  #BruceLee #CoinDemo #BuiltDifferent #MartialArtsLegends #JeetKuneDo #ExplosivePrecision #MindBodyControl #1970sTV #LegendaryMartialArtist #MartialArtsScience",PT15S,en-US,22230207,696476,2026-01-17T00:15:06Z
Entertainment,24,TeMkbeBdCeM,#foryou #story #humor #funny #pov,Rosesyp ,UC0g97yrJ0WL2MleFT1OgnyQ,,PT1M,fr,761372,28597,2026-01-17T15:41:55Z
Entertainment,24,-2Tv9bCmjKY,On dirait pas...🤣🤣,Julien_story,UCM2VgKMCy-JMSMPw-tN1xww,,PT35S,fr,1385815,48701,2026-01-13T16:00:01Z
Entertainment,24,gNz7DHkLELM,#fun #shorts #fyp #reaction #viral #wow #challenge,Nituvi Muzosu,UCQopjxCeSbMZ5GE_UUtTwAQ,"📖🎬🌟 Relaxation & Creative Disclaimer  The channel shares content to entertain, provide calming visuals, and inspire creativity. Illegal content is not promoted 🚫. Some materials follow Fair Use guidelines. All rights remain with original creators ✉️. 📌 Copyright Notice:   All rights belong to their respective owners.   If you own the rights to any content featured in this video, please contact me directly, and I will remove it immediately.",PT16S,fr,336588,9000,2026-01-19T12:01:27Z
Entertainment,24,_cT7O0Swbbw,#acting#fypシ#viral #pov #humor #comedia#drole#miseenscene #pharmacies,Natalie DQ520,UCIh7870x-SSKyxBr_gGQjGQ,,PT59S,en-US,755160,32611,2026-01-16T14:40:00Z
Entertainment,24,Z-n4uoXm8ME,Jones vs. Hurst | Police Academy 5 😅😅😅,CINEMAnuel,UCzPTf0OWQgv7shg0kz8YkbA,"Larvell Jones (Michael Winslow - die menschliche Soundeffekte/Beatbox) rächt sich an Commander Hurst (George Robertson), nachdem dieser seinen Sitz im Flugzeug zum Schlafen ziemlich weit nach hinten lässt und Jones den Platz raubt. Lustiger Clip aus Police Academy 5: Auftrag Miami Beach (OT: Police Academy 5: Assignment Miami Beach). Viel Spaß!  #PoliceAcademy5 #MiamiBeach #Hurst #Jones #80erKomödie  #RetroFilm #Lustig",PT23S,en,20422770,598064,2026-01-13T15:51:24Z
Entertainment,24,6rObmPg-FII,HE DIDN’T EVEN NOTICE! 😏😱🍫 #shorts,Jasmin and James,UC5OVPGQqCUm0CCyVzELGITQ,,PT30S,en,88969893,1436945,2026-01-13T14:00:22Z
Entertainment,24,Ksj68CCNG9M,Il va falloir être plus précis. 🤣,SerendelleLL,UCkTjA1GY6FgMYP7jWPXihhQ,,PT32S,en-US,588575,20528,2026-01-16T23:49:00Z
Entertainment,24,cy8dQZTld1c,Comment ma famille me voit 😂,L'étoile Noire,UCky8Z5AYEHA55-r2TFNC_KA,→ Ma boutique et vidéo personnalisée : Laboutiquelen.com  → Instagram : https://www.instagram.com/etoilenoire__/  → Contact (pro uniquement) LenBusinessCorp@gmail.com  → Any Copyright issue ? Please Feel free to contact me on social to get the problem solved  → Tik Tok : https://www.tiktok.com/@lenytb  → Twitter : https://twitter.com/etoilenoire01,PT11S,fr,490011,19755,2026-01-18T11:12:36Z
Entertainment,24,HWyI0RCISEE,Quand ce sera mon tour d’être parent:,Assountïna,UCR5PY0zSAYfV8C5nGxZ8hWw,,PT31S,fr,602551,36484,2026-01-18T02:43:08Z
Entertainment,24,YglQEhoBC60,SON EXAMEN FINAL ÉTAIT IMPOSSIBLE ! 😱🚒🎓,Neezay 2.0,UCEhEgGDe_NW7cqlvArK6VLg,Neezay 2.0 #shorts   Mail PRO : neezshorts@gmail.com,PT33S,fr,1123857,68025,2026-01-16T17:01:04Z
Entertainment,24,GRFl1-Ut3Qg,On est bien pressé de rentrer chez soit après#shorts #youtubeshorts #shortsforyou #viralshorts#fyp,fnsbsfhg,UCwl63M3kZVP98ICd4PdVLQA,"⚠️Only for Entertainment purpose :- ✅    DISCLAIMER: This Channel does not promote any illegal product, content, or platform, doesn't encourage any kind of prohibited activities. All contents provided by this channel are meant for EDUCATIONAL purposes only      Disclaimer: This Channel Does Not Promote Any illegal content, all contents provided by This Channel is meant for EDUCATIONAL and News Update purpose only. The content is based on individual research.      Copyright Disclaimer Under Section 107 of the Copyright Act 1976, allowance is made for ""fair use"" for purposes such as criticism, comment, news reporting, teaching, scholarship, and research. Fair use is a use permitted by copyright statute that might otherwise be infringing. Non-profit, educational or personal use tips the balance in favor of fair use.  am not the real owner of all the videos shown on our channel and all the credits go to the respectful owner.      In case of copyright issues, please contact us for Credits or Removal.",PT1M21S,fr,387363,15820,2026-01-20T02:29:16Z
Entertainment,24,Uvh_bSiSGs4,#youtube #youtubeshorts #fyp #foryou,sfngoka,UCZG6LhMKloxYnqTlUx1snKA,"⚠️Only for Entertainment purpose :- ✅  DISCLAIMER: This Channel does not promote any illegal product, content, or platform, doesn't encourage any kind of prohibited activities. All contents provided by this channel are meant for EDUCATIONAL purposes only   Disclaimer: This Channel Does Not Promote Any illegal content, all contents provided by This Channel is meant for EDUCATIONAL and News Update purpose only. The content is based on individual research.   Copyright Disclaimer Under Section 107 of the Copyright Act 1976, allowance is made for ""fair use"" for purposes such as criticism, comment, news reporting, teaching, scholarship, and research. Fair use is a use permitted by copyright statute that might otherwise be infringing. Non-profit, educational or personal use tips the balance in favor of fair use. am not the real owner of all the videos shown on our channel and all the credits go to the respectful owner.   In case of copyright issues, please contact us for Credits or Removal.",PT43S,fr,994718,21747,2026-01-16T09:31:25Z
Entertainment,24,EXxZ1HEkH3g,#humour #prof #école #education #drôle #classes,Jeremteach,UCxlcM75FFYK2uIQWQ4qkSUg,,PT23S,fr,334307,21693,2026-01-19T15:28:47Z
Entertainment,24,uEXkxDuFLgc,#fyp#foryou#funny#pov #humour#comedia#povacting,Josh84MH,UCtR0fL-oWHq0gOCZUiA-ytQ,,PT26S,en-US,1147662,40839,2026-01-13T13:18:00Z
Entertainment,24,EZNyOAMjrmk,Mais qui fait les devoirs à la maison ? #humour #shorts.,funnyDaphne789,UC2Ab0DOLIMnuYZ-iEfRz8WA,,PT52S,en-US,371396,31089,2026-01-17T13:05:01Z
Entertainment,24,yFnYgYlNBOQ,🤫N'essayez jamais de défié ce garçon à la dance...,Success School,UC27EL4DaM7rSD6Xj8lenH8Q,"Ce garçon est un véritable grand danseur mais cet homme a voulu le défier sans savoir.  Cette video vous est proposée à but éducatif et de divertissement. Ne reproduisez pas tous ce que vous voyez.   If you have any issues related to this video or your credits are missing then email me at this email address ( successschool2022@gmail.com ) I will remove the video if you have any issues. Do Not Send Copyright Strike or Claim Thanks   All content on this channel is used under the Fair Use policy as outlined in Section 107 of the Copyright Act of 1976. It is used for purposes such as commentary, criticism, news reporting, teaching, scholarship, or research. The materials included are transformed to provide original perspectives, add educational value, or entertain within the legal boundaries of Fair Use. If you believe any content infringes on your copyright, please contact me directly before taking any action. I am committed to resolving any issues promptly.,",PT27S,fr,1274457,29919,2026-01-15T19:25:34Z
Entertainment,24,bL3lReMWpT8,Les Lapins Béliers Sont Des GROSSES CHOCHOTTES 😂🐇 #shorts,Kumo,UCmEZiiCxlATuFcTZdeAX6zA,"Les lapins béliers sont l'incarnation de l'animal de compagnie mignon. Entre leurs oreilles qui leurs tombent devant les yeux, leur petite tete de lapin trop mignon et leur comportement de boule d'amour, tout le monde en est fan ! Par contre il y a des choses ultra importantes à connaitre sur eux avant d'en vouloir un !! 🐇  #lapin #lapins #rabbit #bélier #mignon #animal #animals #animaux #incroyable #nature #kumo",PT1M2S,fr,294292,24369,2026-01-19T23:00:46Z
Entertainment,24,5iY3uL9vbBk,#relatable #skit#comedy #funny#shorts #pov #humour #lego #memes #storytime #humor #edit #food,ct64,UC8FBz419N7gXp9pvK4nKA-Q,,PT46S,fr,889831,17904,2026-01-16T06:56:15Z
Entertainment,24,f6JpjCY7QU8,Du coup on fait quoi ? 🤣,Lennon,UC4gV_ujKk_07ypEqSJtEBeg,,PT50S,en-US,504625,24394,2026-01-17T15:01:14Z
Entertainment,24,ClzR98s4Jkg,🤣 Il suit la Mauvaise Personne,MentalMusculeux,UCBLentRstjYWNE2B7GXISjg,#sport #pourtoi #foryou #foryourpage #storytelling #edit #karma #foot #football #motivation,PT20S,fr,216748,12021,2026-01-20T18:57:33Z
Entertainment,24,EEyZOr-WyC4,“Il se fait avoir par un agent… et son chien saute par la fenêtre😭””#anime？#movie#foryou,Quiverith Film,UCzegsdZHQ5s93VtaE2Ae-Pg,,PT46S,fr-FR,609387,27440,2026-01-15T09:08:24Z
